type,title,cast,rating,listed_in,combination
TV Show,dororo,hiroki suzuki  rio suzuki  naoya uchida,TV-NR,tv shows,TV Show TV-NR tv shows hiroki suzuki  rio suzuki  naoya uchida
TV Show,dora the explorer,dora the explorer  day   howie,TV-Y,kids,TV Show TV-Y kids dora the explorer  day   howie
TV Show,dogs with jobs,unknown,ALL,"documentary, special interest","TV Show ALL documentary, special interest unknown"
TV Show,dog school,julian clary  emma,ALL,documentary,TV Show ALL documentary julian clary  emma
TV Show,dive!!,unknown,TV-NR,tv shows,TV Show TV-NR tv shows unknown
TV Show,dive olly dive,sean-ryan petersen  elle labadie,ALL,"animation, kids","TV Show ALL animation, kids sean-ryan petersen  elle labadie"
TV Show,dinosaurs inside and out,jack horner  robert t. bakker   ph.d.,TV-G,"documentary, special interest","TV Show TV-G documentary, special interest jack horner  robert t. bakker   ph.d."
TV Show,dinosaur train,erika-shaye gair,TV-G,"animation, kids","TV Show TV-G animation, kids erika-shaye gair"
TV Show,dino dana,michela luci  saara chaudry  amish patel,ALL,kids,TV Show ALL kids michela luci  saara chaudry  amish patel
TV Show,dino dan,trek buccino  sarah carver  colin petierre,TV-Y,kids,TV Show TV-Y kids trek buccino  sarah carver  colin petierre
TV Show,dilruk jayasinha: bundle of joy,dilruk jayasinha,16+,"arts, entertainment, and culture","TV Show 16+ arts, entertainment, and culture dilruk jayasinha"
TV Show,die trying,unknown,NR,tv shows,TV Show NR tv shows unknown
TV Show,dickensian,stephen rea  tuppence middleton  anton lesser,TV-PG,drama,TV Show TV-PG drama stephen rea  tuppence middleton  anton lesser
TV Show,diablo guardián,paulina gaitán  andrés almeida  adrián ladrón,18+,drama,TV Show 18+ drama paulina gaitán  andrés almeida  adrián ladrón
TV Show,dexter,michael c. hall  jennifer carpenter  desmond harrington,TV-MA,"drama, suspense","TV Show TV-MA drama, suspense michael c. hall  jennifer carpenter  desmond harrington"
TV Show,detectorists (bbc series),mackenzie crook  toby jones  pearce quigley,TV-14,comedy,TV Show TV-14 comedy mackenzie crook  toby jones  pearce quigley
TV Show,detectives: my killer case,mark birch  martin brunning  howard groves,TV-14,documentary,TV Show TV-14 documentary mark birch  martin brunning  howard groves
TV Show,detective di renjie 2 (hd),liang guanhua  zhang zijian,13+,"action, drama, suspense","TV Show 13+ action, drama, suspense liang guanhua  zhang zijian"
TV Show,design squad,unknown,TV-Y,kids,TV Show TV-Y kids unknown
TV Show,deep water,noah taylor  yael stone  william mcinnes,13+,tv shows,TV Show 13+ tv shows noah taylor  yael stone  william mcinnes
TV Show,deathwish,josh mazerolle  kaylee mary,13+,"action, special interest, sports","TV Show 13+ action, special interest, sports josh mazerolle  kaylee mary"
TV Show,deal or no deal,howie mandel,ALL,"documentary, special interest, unscripted","TV Show ALL documentary, special interest, unscripted howie mandel"
TV Show,dead lucky,rachel griffiths  yoson an  mojean aria,TV-14,"drama, suspense","TV Show TV-14 drama, suspense rachel griffiths  yoson an  mojean aria"
TV Show,dead boss,sharon horgan  jennifer saunders,TV-14,comedy,TV Show TV-14 comedy sharon horgan  jennifer saunders
TV Show,de la vida al plato,juan echanove  alberto fernández bombín  joan roca,TV-G,"documentary, special interest","TV Show TV-G documentary, special interest juan echanove  alberto fernández bombín  joan roca"
TV Show,dci banks,stephen tompkinson  andrea lowe  caroline catz,TV-14,"drama, suspense","TV Show TV-14 drama, suspense stephen tompkinson  andrea lowe  caroline catz"
TV Show,dark/web,michael nardelli  sibongile mlambo  julie benz,18+,"horror, science fiction, suspense","TV Show 18+ horror, science fiction, suspense michael nardelli  sibongile mlambo  julie benz"
TV Show,dark shadows: the beginning,joan bennett  mitchell ryan  louis edmonds,TV-PG,"drama, science fiction","TV Show TV-PG drama, science fiction joan bennett  mitchell ryan  louis edmonds"
TV Show,dark angel,joanne froggatt  jonas armstrong  laura morgan,TV-14,"documentary, drama, special interest","TV Show TV-14 documentary, drama, special interest joanne froggatt  jonas armstrong  laura morgan"
TV Show,daniel tiger's neighborhood,jake beale  heather bambrick  ted dykstra,TV-Y,kids,TV Show TV-Y kids jake beale  heather bambrick  ted dykstra
TV Show,daniel tiger and more snowy adventures,addison holley  amariah faulkner  dalila bela,TV-Y,kids,TV Show TV-Y kids addison holley  amariah faulkner  dalila bela
TV Show,daniel tiger and more incredible stories,addison holley  adeline potts  amariah faulkner,TV-Y,kids,TV Show TV-Y kids addison holley  adeline potts  amariah faulkner
TV Show,daniel tiger and more halloween fun!,addison holley  aidan vissers  amariah faulkner,TV-Y,kids,TV Show TV-Y kids addison holley  aidan vissers  amariah faulkner
TV Show,dangerous roads,angus deayton  mariella frostrup  hugh bonneville,TV-14,"documentary, special interest","TV Show TV-14 documentary, special interest angus deayton  mariella frostrup  hugh bonneville"
TV Show,danger & eggs,aidy bryant  eric knobel,7+,"comedy, kids","TV Show 7+ comedy, kids aidy bryant  eric knobel"
TV Show,dance moms miami,angel armas  debi epstein,TV-PG,"documentary, drama, unscripted","TV Show TV-PG documentary, drama, unscripted angel armas  debi epstein"
TV Show,cyberchase,unknown,TV-Y,"animation, kids","TV Show TV-Y animation, kids unknown"
TV Show,curiosity songs with pinkfong & hogi,unknown,ALL,"animation, kids","TV Show ALL animation, kids unknown"
TV Show,cuna de lobos,paz vega  gonzalo garcía vivanco  paulette hernandez,TV-NR,tv shows,TV Show TV-NR tv shows paz vega  gonzalo garcía vivanco  paulette hernandez
TV Show,cultureshock,judd apatow  steve bannos,TV-14,documentary,TV Show TV-14 documentary judd apatow  steve bannos
TV Show,cuffs,amanda abbington  ashley walters  jacob ifan,16+,"drama, suspense","TV Show 16+ drama, suspense amanda abbington  ashley walters  jacob ifan"
TV Show,cucumber,vincent franklin  freddie fox  julie hesmondhalgh,TV-MA,tv shows,TV Show TV-MA tv shows vincent franklin  freddie fox  julie hesmondhalgh
TV Show,cruisin' route 66 with michael wallis,michael wallis,ALL,tv shows,TV Show ALL tv shows michael wallis
TV Show,crown lake,francesca capaldi  kyla-drew  emily skinner,13+,"drama, young adult audience","TV Show 13+ drama, young adult audience francesca capaldi  kyla-drew  emily skinner"
TV Show,criss angel mindfreak,criss angel  andrew gerard henderson,TV-PG,"drama, suspense","TV Show TV-PG drama, suspense criss angel  andrew gerard henderson"
TV Show,crisis in six scenes,woody allen  miley cyrus  elaine may,13+,"comedy, historical","TV Show 13+ comedy, historical woody allen  miley cyrus  elaine may"
TV Show,crime investigation australia,erryn arkin  olivia stambouliah  steve liebmann,18+,"documentary, suspense","TV Show 18+ documentary, suspense erryn arkin  olivia stambouliah  steve liebmann"
TV Show,crime inc.,unknown,7+,"documentary, special interest","TV Show 7+ documentary, special interest unknown"
TV Show,creative galaxy,unknown,ALL,kids,TV Show ALL kids unknown
TV Show,crazy hearts: nashville,heather byrd  anthony billups,TV-14,"documentary, drama, unscripted","TV Show TV-14 documentary, drama, unscripted heather byrd  anthony billups"
TV Show,craig ferguson presents: hobo fabulous,craig ferguson  joe bolter  tomas zakopal,18+,tv shows,TV Show 18+ tv shows craig ferguson  joe bolter  tomas zakopal
TV Show,country buck$,unknown,TV-PG,"documentary, drama, unscripted","TV Show TV-PG documentary, drama, unscripted unknown"
TV Show,counting cars,unknown,TV-PG,special interest,TV Show TV-PG special interest unknown
TV Show,counterpart,james cromwell  olivia williams  j.k. simmons,TV-MA,"drama, science fiction, special interest","TV Show TV-MA drama, science fiction, special interest james cromwell  olivia williams  j.k. simmons"
TV Show,cougar town,courteney cox  christa miller  busy philipps,TV-14,comedy,TV Show TV-14 comedy courteney cox  christa miller  busy philipps
TV Show,couch to confident 14 day yoga challenge with julia marie,julia marie,ALL,"fitness, special interest","TV Show ALL fitness, special interest julia marie"
TV Show,costume quest,candi milo  kari wahlgren  fred tatasciore,7+,kids,TV Show 7+ kids candi milo  kari wahlgren  fred tatasciore
TV Show,cosmic quantum ray series,tom kenny  sam vincent,ALL,"kids, science fiction","TV Show ALL kids, science fiction tom kenny  sam vincent"
TV Show,cosmic kids yoga adventures,jaime amor,ALL,"fitness, kids","TV Show ALL fitness, kids jaime amor"
TV Show,corazon contento,enrique altamira  blanca echeverria  jimena picos,TV-NR,comedy,TV Show TV-NR comedy enrique altamira  blanca echeverria  jimena picos
TV Show,construction squad of car city,unknown,ALL,kids,TV Show ALL kids unknown
TV Show,constitution usa with peter sagal,unknown,TV-PG,"documentary, special interest","TV Show TV-PG documentary, special interest unknown"
TV Show,comrade detective,channing tatum  joseph gordon-levitt  jenny slate,18+,comedy,TV Show 18+ comedy channing tatum  joseph gordon-levitt  jenny slate
TV Show,cómo sobrevivir soltero,sebastián zurita  tato alexander  roberto flores,16+,comedy,TV Show 16+ comedy sebastián zurita  tato alexander  roberto flores
TV Show,community,joel mchale  gillian jacobs  danny pudi,TV-PG,tv shows,TV Show TV-PG tv shows joel mchale  gillian jacobs  danny pudi
TV Show,comicstaan semma comedy pa,karthik kumar  praveen kumar  rajmohan arumugam,13+,comedy,TV Show 13+ comedy karthik kumar  praveen kumar  rajmohan arumugam
TV Show,comicstaan,zakir khan  kenny sebastian  biswa kalyan rath,16+,"arts, entertainment, and culture, international, unscripted","TV Show 16+ arts, entertainment, and culture, international, unscripted zakir khan  kenny sebastian  biswa kalyan rath"
TV Show,colourcloud palace,unknown,13+,"action, animation, anime","TV Show 13+ action, animation, anime unknown"
TV Show,cold case files,bill kurtis,TV-14,tv shows,TV Show TV-14 tv shows bill kurtis
TV Show,cody,gary sweet  robert mammone  heather mitchell,16+,"action, suspense","TV Show 16+ action, suspense gary sweet  robert mammone  heather mitchell"
TV Show,cobra puma golf all-access show,unknown,TV-NR,sports,TV Show TV-NR sports unknown
TV Show,clifford's puppy days,lara miller   grey delisle   kath soucie,TV-Y,kids,TV Show TV-Y kids lara miller   grey delisle   kath soucie
TV Show,clifford the big red dog,hannah levinson  adam sanders,ALL,kids,TV Show ALL kids hannah levinson  adam sanders
TV Show,clifford the big red dog,john ritter   kel mitchell   cree summer,TV-Y,tv shows,TV Show TV-Y tv shows john ritter   kel mitchell   cree summer
TV Show,"click, clack, moo: christmas at the farm",pete davidson  rachel bloom  patton oswalt,ALL,kids,TV Show ALL kids pete davidson  rachel bloom  patton oswalt
TV Show,classic popeye,jack mercer  mae questel  jackson beck,TV-Y,"animation, kids","TV Show TV-Y animation, kids jack mercer  mae questel  jackson beck"
TV Show,chuck,zachary levi  yvonne strahovski  joshua gomez,TV-14,"action, adventure, comedy","TV Show TV-14 action, adventure, comedy zachary levi  yvonne strahovski  joshua gomez"
TV Show,chris tall presents...,chris tall,16+,"arts, entertainment, and culture, comedy","TV Show 16+ arts, entertainment, and culture, comedy chris tall"
TV Show,chris ramsey: approval needed,unknown,16+,tv shows,TV Show 16+ tv shows unknown
TV Show,chris ramsey approval needed (4k uhd),unknown,16+,"arts, entertainment, and culture","TV Show 16+ arts, entertainment, and culture unknown"
TV Show,chris harris on cars,chris harris,TV-PG,tv shows,TV Show TV-PG tv shows chris harris
TV Show,children's favorite fairy tales and nursery rhymes,unknown,ALL,"animation, kids","TV Show ALL animation, kids unknown"
TV Show,children of giant,unknown,TV-PG,special interest,TV Show TV-PG special interest unknown
TV Show,child genius,leland melvin  arnav krishna,TV-PG,"documentary, drama, kids","TV Show TV-PG documentary, drama, kids leland melvin  arnav krishna"
TV Show,chi's sweet adventure,maaya sakamoto  makoto yasumura  rikiya koyama,ALL,"anime, international, kids","TV Show ALL anime, international, kids maaya sakamoto  makoto yasumura  rikiya koyama"
TV Show,chasing the crown: dreamers to streamers,tucker boner aka jericho  annemunition  actionjaxon,13+,adventure,TV Show 13+ adventure tucker boner aka jericho  annemunition  actionjaxon
TV Show,chasing november,bill winke  jared mills,13+,"documentary, drama, special interest","TV Show 13+ documentary, drama, special interest bill winke  jared mills"
TV Show,charles i downfall of a king,lisa hilton,13+,tv shows,TV Show 13+ tv shows lisa hilton
TV Show,changing rooms,natalia bassingthwaighte  tim leveson,ALL,"special interest, unscripted","TV Show ALL special interest, unscripted natalia bassingthwaighte  tim leveson"
TV Show,chacha vidhayak hain humare,zakir khan  vyom sharma  kumar varun,13+,"comedy, drama","TV Show 13+ comedy, drama zakir khan  vyom sharma  kumar varun"
TV Show,celia pacquola: all talk,celia pacquola,16+,"comedy, talk show and variety","TV Show 16+ comedy, talk show and variety celia pacquola"
TV Show,celebrity paranormal project,mariel hemingway  julio iglesias jr.,16+,tv shows,TV Show 16+ tv shows mariel hemingway  julio iglesias jr.
TV Show,celebrity house hunting,unknown,TV-PG,tv shows,TV Show TV-PG tv shows unknown
TV Show,celebrity home raiders,unknown,TV-PG,tv shows,TV Show TV-PG tv shows unknown
TV Show,celebrity ghost stories,a. jones,TV-PG,tv shows,TV Show TV-PG tv shows a. jones
TV Show,celebrity close calls,branden wellington,TV-14,"documentary, drama, unscripted","TV Show TV-14 documentary, drama, unscripted branden wellington"
TV Show,cave club,shelby young  keylor leigh  will haza,ALL,"animation, kids","TV Show ALL animation, kids shelby young  keylor leigh  will haza"
TV Show,catherine the great,yuliya snigir  natalya surkova  pavel derevyanko,13+,"action, drama","TV Show 13+ action, drama yuliya snigir  natalya surkova  pavel derevyanko"
TV Show,catching milat,mal kennard  richard cawthorne  geoff morrell,16+,suspense,TV Show 16+ suspense mal kennard  richard cawthorne  geoff morrell
TV Show,catastrophe,rob delaney  sharon horgan,18+,"comedy, romance","TV Show 18+ comedy, romance rob delaney  sharon horgan"
TV Show,caronte,roberto álamo  miriam giovanelli  belén lópez,TV-MA,"drama, suspense","TV Show TV-MA drama, suspense roberto álamo  miriam giovanelli  belén lópez"
TV Show,carnival row,orlando bloom  caroline ford  cara delevingne,16+,"drama, fantasy, suspense","TV Show 16+ drama, fantasy, suspense orlando bloom  caroline ford  cara delevingne"
TV Show,care bears: unlock the music - songs for kids,unknown,ALL,"animation, kids","TV Show ALL animation, kids unknown"
TV Show,card sharks with jim perry,jim perry,TV-G,unscripted,TV Show TV-G unscripted jim perry
TV Show,card sharks with bob eubanks,bob eubanks,TV-G,unscripted,TV Show TV-G unscripted bob eubanks
TV Show,car patrol of car city,unknown,ALL,"animation, kids","TV Show ALL animation, kids unknown"
TV Show,car hunters,danny koker,TV-PG,"documentary, drama, unscripted","TV Show TV-PG documentary, drama, unscripted danny koker"
TV Show,car crash tv,chris barrie,13+,"action, documentary","TV Show 13+ action, documentary chris barrie"
TV Show,canada: a year in the wild,david suchet,13+,documentary,TV Show 13+ documentary david suchet
TV Show,camp x and the birth of the cia,unknown,16+,"documentary, drama, special interest","TV Show 16+ documentary, drama, special interest unknown"
TV Show,call santa,amazon kids,ALL,"animation, kids","TV Show ALL animation, kids amazon kids"
TV Show,call of the wild,nick mancuso  shane meier  rachel hayward,TV-Y7,"action, adventure, drama","TV Show TV-Y7 action, adventure, drama nick mancuso  shane meier  rachel hayward"
TV Show,caligula,koji higashino  koji imada,13+,"comedy, international, unscripted","TV Show 13+ comedy, international, unscripted koji higashino  koji imada"
TV Show,cajun pawn stars,unknown,TV-14,tv shows,TV Show TV-14 tv shows unknown
TV Show,caillou,evan smirnow  ellen david  jennifer seguin,TV-G,kids,TV Show TV-G kids evan smirnow  ellen david  jennifer seguin
TV Show,busytown mysteries,kevin dennis  joanne vannicola  paul wensley,ALL,"animation, kids","TV Show ALL animation, kids kevin dennis  joanne vannicola  paul wensley"
TV Show,busy world of richard scarry,unknown,TV-Y7,"animation, kids","TV Show TV-Y7 animation, kids unknown"
TV Show,burn notice,bruce campbell  kiele sanchez  ronreaco lee,TV-PG,drama,TV Show TV-PG drama bruce campbell  kiele sanchez  ronreaco lee
TV Show,bulge bracket,jessika van  feodor chin  lanny joon,16+,"comedy, drama","TV Show 16+ comedy, drama jessika van  feodor chin  lanny joon"
TV Show,building the dream nashville,vern yip  carisha swanson,7+,"documentary, special interest","TV Show 7+ documentary, special interest vern yip  carisha swanson"
TV Show,building dream homes,richard wilson,TV-PG,"documentary, special interest","TV Show TV-PG documentary, special interest richard wilson"
TV Show,building cars,james may  ant anstead  kate humble,TV-PG,special interest,TV Show TV-PG special interest james may  ant anstead  kate humble
TV Show,bug diaries,abigail harrison  nilah rivera  logan smith,ALL,kids,TV Show ALL kids abigail harrison  nilah rivera  logan smith
TV Show,buffy the vampire slayer,sarah michelle gellar  nicholas brendon  alyson hannigan,TV-14,"action, adventure, drama","TV Show TV-14 action, adventure, drama sarah michelle gellar  nicholas brendon  alyson hannigan"
TV Show,britain's best drives,richard wilson,TV-PG,"documentary, special interest","TV Show TV-PG documentary, special interest richard wilson"
TV Show,britain by narrowboat,colin dobson-fox  shaun dobson-fox,13+,"documentary, special interest, unscripted","TV Show 13+ documentary, special interest, unscripted colin dobson-fox  shaun dobson-fox"
TV Show,bring it,unknown,TV-PG,tv shows,TV Show TV-PG tv shows unknown
TV Show,breathe: into the shadows,abhishek a. bachchan  amit sadh  nithya menen,13+,"drama, suspense","TV Show 13+ drama, suspense abhishek a. bachchan  amit sadh  nithya menen"
TV Show,breathe,amit sadh  neena kulkarni  sapna pabbi,16+,drama,TV Show 16+ drama amit sadh  neena kulkarni  sapna pabbi
TV Show,bread barbershop,unknown,ALL,"animation, kids","TV Show ALL animation, kids unknown"
TV Show,brandi and jarrod: married to the job,brandi passante  jarrod schulz,TV-PG,tv shows,TV Show TV-PG tv shows brandi passante  jarrod schulz
TV Show,brand new house on a budget,unknown,13+,"special interest, unscripted","TV Show 13+ special interest, unscripted unknown"
TV Show,boys over flowers,ku hye-sun  lee min-ho  kim hyun-joong,13+,"comedy, drama, romance","TV Show 13+ comedy, drama, romance ku hye-sun  lee min-ho  kim hyun-joong"
TV Show,bottom,unknown,TV-PG,comedy,TV Show TV-PG comedy unknown
TV Show,born this way,sean mcelwee  rachel osterbach,TV-PG,"documentary, drama, unscripted","TV Show TV-PG documentary, drama, unscripted sean mcelwee  rachel osterbach"
TV Show,born behind bars,unknown,TV-14,"documentary, drama, unscripted","TV Show TV-14 documentary, drama, unscripted unknown"
TV Show,bordertown: laredo,unknown,TV-14,"documentary, special interest","TV Show TV-14 documentary, special interest unknown"
TV Show,bookaboo uk,unknown,TV-NR,kids,TV Show TV-NR kids unknown
TV Show,bookaboo,marcus clarke  matt ficner  jason hopley,ALL,kids,TV Show ALL kids marcus clarke  matt ficner  jason hopley
TV Show,bones,emily deschanel  david boreanaz  michaela conlin,NR,"drama, suspense","TV Show NR drama, suspense emily deschanel  david boreanaz  michaela conlin"
TV Show,boing: the play ranger,unknown,ALL,"animation, kids","TV Show ALL animation, kids unknown"
TV Show,bobby's world: the complete series,howie mandel,ALL,"animation, kids","TV Show ALL animation, kids howie mandel"
TV Show,boarding school juliet,yuki ono  ai kayano  ayane sakura,NR,tv shows,TV Show NR tv shows yuki ono  ai kayano  ayane sakura
TV Show,bo on the go,unknown,TV-Y7,"animation, kids","TV Show TV-Y7 animation, kids unknown"
TV Show,blue murder: killer cop,richard roxburgh  matt nable  justin smith,16+,"drama, suspense","TV Show 16+ drama, suspense richard roxburgh  matt nable  justin smith"
TV Show,blue mountain state,alan ritchson  darin brooks  gabrielle dennis,TV-MA,comedy,TV Show TV-MA comedy alan ritchson  darin brooks  gabrielle dennis
TV Show,blood & treasure,unknown,TV-14,tv shows,TV Show TV-14 tv shows unknown
TV Show,blockbusters with bill cullen,bill cullen,TV-G,unscripted,TV Show TV-G unscripted bill cullen
TV Show,blippi - videos for kids,stevin john,ALL,"kids, special interest","TV Show ALL kids, special interest stevin john"
TV Show,blippi - educational videos for children,stevin john,ALL,kids,TV Show ALL kids stevin john
TV Show,blippi - educational songs for kids,stevin john,ALL,kids,TV Show ALL kids stevin john
TV Show,bleak old shop of stuff,robert webb  stephen fry  katherine parkinson,TV-PG,comedy,TV Show TV-PG comedy robert webb  stephen fry  katherine parkinson
TV Show,blade of the immortal,kenjiro tsuda  ayane sakura  nozomu sasaki,TV-NR,anime,TV Show TV-NR anime kenjiro tsuda  ayane sakura  nozomu sasaki
TV Show,billy the exterminator,billy bretherton,TV-PG,"documentary, drama, unscripted","TV Show TV-PG documentary, drama, unscripted billy bretherton"
TV Show,billion dollar wreck,martin bayerle,TV-PG,tv shows,TV Show TV-PG tv shows martin bayerle
TV Show,biggie: the life of notorious b.i.g.,voletta wallace  cheo hodari coker,18+,documentary,TV Show 18+ documentary voletta wallace  cheo hodari coker
TV Show,big shrimpin',jeremy schjott,13+,"documentary, drama, unscripted","TV Show 13+ documentary, drama, unscripted jeremy schjott"
TV Show,big easy motors,grant bayerle  martin bayerle  billy bretherton,TV-PG,"documentary, drama, unscripted","TV Show TV-PG documentary, drama, unscripted grant bayerle  martin bayerle  billy bretherton"
TV Show,"big dreams, small spaces",monty don,ALL,"special interest, unscripted","TV Show ALL special interest, unscripted monty don"
TV Show,big dogs,brett cullen  manny perez  michael rabe,16+,"action, drama, suspense","TV Show 16+ action, drama, suspense brett cullen  manny perez  michael rabe"
TV Show,bibi & tina,unknown,ALL,kids,TV Show ALL kids unknown
TV Show,bhoomi hindi,naziya sheik  arun babu,18+,drama,TV Show 18+ drama naziya sheik  arun babu
TV Show,between two ferns,zach galifianakis  jerry seinfeld  hillary clinton,TV-14,comedy,TV Show TV-14 comedy zach galifianakis  jerry seinfeld  hillary clinton
TV Show,betsy's kindergarten adventures,nancy cartwright  tom kenny  daveigh chase,ALL,"animation, kids","TV Show ALL animation, kids nancy cartwright  tom kenny  daveigh chase"
TV Show,betas,joe dinicol  karan soni  jon daly,TV-MA,comedy,TV Show TV-MA comedy joe dinicol  karan soni  jon daly
TV Show,best of babyfirst art music language and more,unknown,ALL,"animation, kids","TV Show ALL animation, kids unknown"
TV Show,best in bridal,david gaffke  frank margini,TV-PG,"documentary, drama, unscripted","TV Show TV-PG documentary, drama, unscripted david gaffke  frank margini"
TV Show,berry and dolly,becca laidler,ALL,"animation, kids","TV Show ALL animation, kids becca laidler"
TV Show,berlin 1945,ben posener  yan schoenefeld  christian serritiello,13+,"documentary, special interest","TV Show 13+ documentary, special interest ben posener  yan schoenefeld  christian serritiello"
TV Show,behind bars: rookie year,austin naulty,TV-14,documentary,TV Show TV-14 documentary austin naulty
TV Show,bed of roses,kerry armstrong  julia blake  hanna mangan lawrence,16+,tv shows,TV Show 16+ tv shows kerry armstrong  julia blake  hanna mangan lawrence
TV Show,becoming evil: serial killers,steven ainsworth  steven answorth  marko bennachimo,TV-14,"documentary, special interest","TV Show TV-14 documentary, special interest steven ainsworth  steven answorth  marko bennachimo"
TV Show,beauty and the geek australia,james tobin,18+,"comedy, documentary, unscripted","TV Show 18+ comedy, documentary, unscripted james tobin"
TV Show,beatless,takuto yoshinaga  nao toyama  misako tomioka,TV-NR,tv shows,TV Show TV-NR tv shows takuto yoshinaga  nao toyama  misako tomioka
TV Show,beat,svenja jung  gudrun ritter  karoline herfurth,18+,"drama, international","TV Show 18+ drama, international svenja jung  gudrun ritter  karoline herfurth"
TV Show,bear's wild weekends,bear grylls  miranda hart  jonathan ross,TV-G,"action, documentary","TV Show TV-G action, documentary bear grylls  miranda hart  jonathan ross"
TV Show,be the boss,bill dunn  bob johnston,TV-PG,tv shows,TV Show TV-PG tv shows bill dunn  bob johnston
TV Show,battlezone wwii: nazi blitzkrieg-the battle for france,unknown,13+,"action, documentary, special interest","TV Show 13+ action, documentary, special interest unknown"
TV Show,battle 360,alan pietruszewski,TV-PG,tv shows,TV Show TV-PG tv shows alan pietruszewski
TV Show,battery the animation (english subtitled),kouki uchiyama  tasuku hatanaka  yui fujimaki,TV-NR,tv shows,TV Show TV-NR tv shows kouki uchiyama  tasuku hatanaka  yui fujimaki
TV Show,basil rathbone sherlock holmes in color!,basil rathbone  nigel bruce  patricia morison,7+,suspense,TV Show 7+ suspense basil rathbone  nigel bruce  patricia morison
TV Show,barter kings,unknown,TV-PG,"documentary, drama, unscripted","TV Show TV-PG documentary, drama, unscripted unknown"
TV Show,barney,dean wendt  carey stinson  julie johnson,TV-Y,kids,TV Show TV-Y kids dean wendt  carey stinson  julie johnson
TV Show,barbie dreamtopia (spanish audio),unknown,TV-Y,"animation, kids","TV Show TV-Y animation, kids unknown"
TV Show,barbie dreamtopia,erica lindbeck  meira blinkoff  lucien dodge,TV-Y,"animation, kids","TV Show TV-Y animation, kids erica lindbeck  meira blinkoff  lucien dodge"
