type,title,cast,rating,listed_in,combination
TV Show,animacars - truck and animal's adventures,unknown,ALL,"animation, kids","TV Show ALL animation, kids unknown"
TV Show,vip pets,unknown,ALL,"animation, kids","TV Show ALL animation, kids unknown"
TV Show,mussolini: the untold story,robert downey jr.  george c. scott  gabriel byrne,13+,action,TV Show 13+ action robert downey jr.  george c. scott  gabriel byrne
TV Show,live the wild life,gus congemi,TV-MA,sports,TV Show TV-MA sports gus congemi
TV Show,ghost hunters,jason hawes  steve gonsalves  dave tango,TV-14,"documentary, unscripted","TV Show TV-14 documentary, unscripted jason hawes  steve gonsalves  dave tango"
TV Show,detentionaire,jonathan tan  zachary bennett  ryan belleville,TV-Y7,"animation, comedy, kids","TV Show TV-Y7 animation, comedy, kids jonathan tan  zachary bennett  ryan belleville"
TV Show,dreams come true prime video show,dreams come true,13+,music videos and concerts,TV Show 13+ music videos and concerts dreams come true
TV Show,the big house,paul sorvino,TV-PG,tv shows,TV Show TV-PG tv shows paul sorvino
TV Show,latin flow (original spanish audio),unknown,TV-14,unscripted,TV Show TV-14 unscripted unknown
TV Show,heroes never die the miniseries,vyacheslav dovzhenko  roman yasinovskiy  andrey isaenko,TV-14,"action, drama","TV Show TV-14 action, drama vyacheslav dovzhenko  roman yasinovskiy  andrey isaenko"
TV Show,el cid,unknown,16+,drama,TV Show 16+ drama unknown
TV Show,beywarriors: beyraiderz,christopher jacot  austin di iulio  zachary bennett,TV-Y7,"action, animation, anime","TV Show TV-Y7 action, animation, anime christopher jacot  austin di iulio  zachary bennett"
TV Show,series before 1c onboarding - 2,1,18+,"action, animation","TV Show 18+ action, animation 1"
TV Show,d.n. ace,lyon smith  samantha weinsten  juan chioran,TV-G,"action, animation, kids","TV Show TV-G action, animation, kids lyon smith  samantha weinsten  juan chioran"
TV Show,tooth & claw,tooth & claw field staff,13+,"action, adventure, sports","TV Show 13+ action, adventure, sports tooth & claw field staff"
TV Show,socially distanced,jeff willy  kirsten trammell  priya gopalan,16+,"comedy, drama","TV Show 16+ comedy, drama jeff willy  kirsten trammell  priya gopalan"
TV Show,old fashioned,natalia jerez  mauricio mejia  carlos fernández,16+,tv shows,TV Show 16+ tv shows natalia jerez  mauricio mejia  carlos fernández
TV Show,great canal journeys,timothy west  prunella scales,7+,"documentary, special interest","TV Show 7+ documentary, special interest timothy west  prunella scales"
TV Show,friendmates,lukerya ilyashenko  artyom tsukanov  dmitry endaltsev,16+,comedy,TV Show 16+ comedy lukerya ilyashenko  artyom tsukanov  dmitry endaltsev
TV Show,diff'rent strokes,conrad bain  gary coleman  todd bridges,TV-PG,"comedy, kids","TV Show TV-PG comedy, kids conrad bain  gary coleman  todd bridges"
TV Show,chasing angel,c. andrew garrison  talia liccardello,TV-14,"romance, suspense","TV Show TV-14 romance, suspense c. andrew garrison  talia liccardello"
TV Show,badanamu stories,hudson meek  christopher nguyen  mollie masters,ALL,"animation, kids","TV Show ALL animation, kids hudson meek  christopher nguyen  mollie masters"
TV Show,227,marla gibbs  hal williams  alaina reed,TV-PG,comedy,TV Show TV-PG comedy marla gibbs  hal williams  alaina reed
TV Show,jane and the dragon,tajja isen  adrian truss  mark rendall,TV-Y7,"animation, kids, science fiction","TV Show TV-Y7 animation, kids, science fiction tajja isen  adrian truss  mark rendall"
TV Show,before future boy,scott rubin  hui wang  cuty lin,16+,comedy,TV Show 16+ comedy scott rubin  hui wang  cuty lin
TV Show,the sun is in you,amina autalif  eldar otarbayev  kuanysh kerimkulov,13+,"drama, romance","TV Show 13+ drama, romance amina autalif  eldar otarbayev  kuanysh kerimkulov"
TV Show,the father,azat seitimetov  zhuldyz anuarova  alikhan beksultan,13+,drama,TV Show 13+ drama azat seitimetov  zhuldyz anuarova  alikhan beksultan
TV Show,tales from the stranger side,pepe  alison young,16+,suspense,TV Show 16+ suspense pepe  alison young
TV Show,snowy river: the mcgregor saga,andrew clarke  brett climo  guy pierce,TV-PG,"drama, western","TV Show TV-PG drama, western andrew clarke  brett climo  guy pierce"
TV Show,pink - love of girls,leticia chaves  deborah steffanie  dani scofano,16+,"drama, lgbtq, romance","TV Show 16+ drama, lgbtq, romance leticia chaves  deborah steffanie  dani scofano"
TV Show,modern love,minnie driver  kit harington  dominique fishback,16+,"comedy, drama, romance","TV Show 16+ comedy, drama, romance minnie driver  kit harington  dominique fishback"
TV Show,la familia,pau gasol  marc gasol  jorge garbajosa,TV-G,sports,TV Show TV-G sports pau gasol  marc gasol  jorge garbajosa
TV Show,hostel daze (4k uhd),adarsh gourav  luv vispute  shubham gaur,16+,"comedy, drama","TV Show 16+ comedy, drama adarsh gourav  luv vispute  shubham gaur"
TV Show,hostel daze,adarsh gourav  luv vispute  shubham gaur,16+,"comedy, drama","TV Show 16+ comedy, drama adarsh gourav  luv vispute  shubham gaur"
TV Show,fleabag monkeyface,teresa gallagher  bob golding  jules de jongh,7+,"animation, comedy, kids","TV Show 7+ animation, comedy, kids teresa gallagher  bob golding  jules de jongh"
TV Show,double solid love,alexey chadov  vyacheslav razbegaev  maxim drozd,13+,tv shows,TV Show 13+ tv shows alexey chadov  vyacheslav razbegaev  maxim drozd
TV Show,cafe midnight,doyoung  kim in-yi,13+,tv shows,TV Show 13+ tv shows doyoung  kim in-yi
TV Show,brain candy tv - educational videos for kids,unknown,ALL,kids,TV Show ALL kids unknown
TV Show,american commando,mark watson  mike abbott  mieke blischke,16+,action,TV Show 16+ action mark watson  mike abbott  mieke blischke
TV Show,the deep,minnie driver  goran visnjic  james nesbitt,TV-14,tv shows,TV Show TV-14 tv shows minnie driver  goran visnjic  james nesbitt
TV Show,to dine for with kate sullivan,kate sullivan,TV-G,"documentary, special interest","TV Show TV-G documentary, special interest kate sullivan"
TV Show,series before 1c onboarding - 1,1,13+,tv shows,TV Show 13+ tv shows 1
TV Show,pinkfong! job songs,unknown,TV-G,"animation, kids","TV Show TV-G animation, kids unknown"
TV Show,miss multiverse - australia,yolandi franken  diab metry  tom gay,13+,unscripted,TV Show 13+ unscripted yolandi franken  diab metry  tom gay
TV Show,ishida and asakura,joshua waters  cole feuchter  steve warky nunez,16+,"animation, anime","TV Show 16+ animation, anime joshua waters  cole feuchter  steve warky nunez"
TV Show,babybus - cartoon for kids,kiki,ALL,"animation, kids","TV Show ALL animation, kids kiki"
TV Show,the deer and the cauldron,zhang yi shan  tina tang  zhang tian yang,13+,"action, comedy","TV Show 13+ action, comedy zhang yi shan  tina tang  zhang tian yang"
TV Show,shadow society,christopher reilly  paul venier  jenna jace,18+,science fiction,TV Show 18+ science fiction christopher reilly  paul venier  jenna jace
TV Show,the shadownsters,laurence bouvard  hugo harrold harrison  eric mayers,7+,"animation, kids","TV Show 7+ animation, kids laurence bouvard  hugo harrold harrison  eric mayers"
TV Show,founding,sergey denga  euphrosyne melnik  ksenia mishina,16+,drama,TV Show 16+ drama sergey denga  euphrosyne melnik  ksenia mishina
TV Show,pinkfong arts & crafts: wonderstar,unknown,ALL,"animation, kids","TV Show ALL animation, kids unknown"
TV Show,helix studios presents,alex riley  travis stevens  max carter,18+,"comedy, lgbtq, romance","TV Show 18+ comedy, lgbtq, romance alex riley  travis stevens  max carter"
TV Show,babar,gordon pinsent  stuart stone  janet-laine green,TV-Y,"animation, comedy, kids","TV Show TV-Y animation, comedy, kids gordon pinsent  stuart stone  janet-laine green"
TV Show,the wolf princess,jason gu  ning kang  huizi sheng,18+,"comedy, romance","TV Show 18+ comedy, romance jason gu  ning kang  huizi sheng"
TV Show,starhunter redux,clive robertson  tanya allen  dawn stern,TV-PG,science fiction,TV Show TV-PG science fiction clive robertson  tanya allen  dawn stern
TV Show,roots less traveled,faruq tauheed,TV-G,"documentary, kids, special interest","TV Show TV-G documentary, kids, special interest faruq tauheed"
TV Show,mean mums,morgana o'reilly  anna jullienne  allan henry,TV-14,comedy,TV Show TV-14 comedy morgana o'reilly  anna jullienne  allan henry
TV Show,little black book,ikechukwu onunaku  teniola aladese  anee icha,13+,"drama, romance","TV Show 13+ drama, romance ikechukwu onunaku  teniola aladese  anee icha"
TV Show,class of the titans,kirby morrow  kelly sheridan  sam vincent,TV-G,"action, animation, kids","TV Show TV-G action, animation, kids kirby morrow  kelly sheridan  sam vincent"
TV Show,being ian,richard cox  louis chirillo  patricia drake,TV-G,"animation, kids, suspense","TV Show TV-G animation, kids, suspense richard cox  louis chirillo  patricia drake"
TV Show,a place called hollywood,kristos andrews  meg foster  adetokumboh m'cormack,16+,"comedy, drama","TV Show 16+ comedy, drama kristos andrews  meg foster  adetokumboh m'cormack"
TV Show,super password,bert convy,TV-G,unscripted,TV Show TV-G unscripted bert convy
TV Show,steve and maggie - funny friends,steve r. watts  maggie,ALL,"animation, kids","TV Show ALL animation, kids steve r. watts  maggie"
TV Show,garth marenghi's darkplace,richard ayoade  matthew holness  matt berry,18+,comedy,TV Show 18+ comedy richard ayoade  matthew holness  matt berry
TV Show,oh no! it's an alien invasion,eden gamliel  al mukadam  dan chameroy,TV-G,"animation, kids","TV Show TV-G animation, kids eden gamliel  al mukadam  dan chameroy"
TV Show,the mystery of dr. zach,yaroslav payuk  sergey zaoburniy,13+,"special interest, suspense","TV Show 13+ special interest, suspense yaroslav payuk  sergey zaoburniy"
TV Show,the moth effect,jazz twemlow  nick boshier,NR,comedy,TV Show NR comedy jazz twemlow  nick boshier
TV Show,the gunrunner billy kane,mark arnold  john kassir  m.d. selig,16+,"romance, science fiction, western","TV Show 16+ romance, science fiction, western mark arnold  john kassir  m.d. selig"
TV Show,tee and mo,lauren laverne,ALL,tv shows,TV Show ALL tv shows lauren laverne
TV Show,kenneth copeland 2021,kenneth copeland,TV-G,"faith and spirituality, kids, special interest","TV Show TV-G faith and spirituality, kids, special interest kenneth copeland"
TV Show,car school,roman safronov,TV-Y,"animation, kids","TV Show TV-Y animation, kids roman safronov"
TV Show,aham bhramhasmi,rajath raghav  abhay bethiganti  sai ketan rao,13+,"action, drama, suspense","TV Show 13+ action, drama, suspense rajath raghav  abhay bethiganti  sai ketan rao"
TV Show,marty is dead,jakub nemčok  jan grundman  petra bučková,16+,"action, drama","TV Show 16+ action, drama jakub nemčok  jan grundman  petra bučková"
TV Show,jungle box,unknown,7+,"animation, kids","TV Show 7+ animation, kids unknown"
TV Show,i fell in love with a sanki,swati negi  shubham gupta  vikram kochhar,16+,"comedy, romance","TV Show 16+ comedy, romance swati negi  shubham gupta  vikram kochhar"
TV Show,the triumph of soul,humberto montes  angi corso,18+,special interest,TV Show 18+ special interest humberto montes  angi corso
TV Show,gourmet in tang dynasty,zixuan li  runnan liu,18+,tv shows,TV Show 18+ tv shows zixuan li  runnan liu
TV Show,enter the mack,rio sirah  cherrie garden  asylum klown,TV-MA,drama,TV Show TV-MA drama rio sirah  cherrie garden  asylum klown
TV Show,buzzfeed unsolved: true crime,ryan bergara  shane madej,16+,"documentary, horror, suspense","TV Show 16+ documentary, horror, suspense ryan bergara  shane madej"
TV Show,american horror story,unknown,TV-MA,"drama, horror, suspense","TV Show TV-MA drama, horror, suspense unknown"
TV Show,funny little stories,unknown,16+,comedy,TV Show 16+ comedy unknown
TV Show,fallout,mark mitchell  ian mune,13+,tv shows,TV Show 13+ tv shows mark mitchell  ian mune
TV Show,thus spoke kishibe rohan,issey takahashi  marie iitoyo  tomoya nakamura,16+,"comedy, drama","TV Show 16+ comedy, drama issey takahashi  marie iitoyo  tomoya nakamura"
TV Show,wildfire,genevieve padalecki  nicole tubiola  nana visitor,TV-14,drama,TV Show TV-14 drama genevieve padalecki  nicole tubiola  nana visitor
TV Show,"thomas & friends 18, 19, 20, 21",joseph may,TV-Y,"animation, kids","TV Show TV-Y animation, kids joseph may"
TV Show,the bronx bunny show,mick o'hara  ciaran morrison  kelly carlson,TV-PG,comedy,TV Show TV-PG comedy mick o'hara  ciaran morrison  kelly carlson
TV Show,outrageous vacation videos,eric boardman,TV-G,documentary,TV Show TV-G documentary eric boardman
TV Show,lovespring international,mystro clark  jennifer elise cox  jane lynch,TV-14,tv shows,TV Show TV-14 tv shows mystro clark  jennifer elise cox  jane lynch
TV Show,kuntergrau,unknown,16+,"drama, lgbtq, romance","TV Show 16+ drama, lgbtq, romance unknown"
TV Show,deadbeat,tyler labine  cat deeley  brandon t. jackson,TV-14,comedy,TV Show TV-14 comedy tyler labine  cat deeley  brandon t. jackson
TV Show,con man,alan tudyk  jack donner  nathan fillion,TV-MA,comedy,TV Show TV-MA comedy alan tudyk  jack donner  nathan fillion
TV Show,bite me,yousef abu-taleb  justin giddings  ryan welsh,TV-MA,"comedy, horror","TV Show TV-MA comedy, horror yousef abu-taleb  justin giddings  ryan welsh"
TV Show,ascension,brandon p. bell  tricia helfer  brian van holt,TV-MA,"drama, science fiction","TV Show TV-MA drama, science fiction brandon p. bell  tricia helfer  brian van holt"
TV Show,rosemary's baby,zoe saldana  patrick j. adams,TV-14,drama,TV Show TV-14 drama zoe saldana  patrick j. adams
TV Show,baby shark's day at school,unknown,TV-G,"animation, kids","TV Show TV-G animation, kids unknown"
TV Show,the guard,steve bacic   zoie palmer  jeremy guilbaut,TV-14,drama,TV Show TV-14 drama steve bacic   zoie palmer  jeremy guilbaut
TV Show,nightcap,ali wentworth  lauren blumenfeld  don fanelli,TV-14,comedy,TV Show TV-14 comedy ali wentworth  lauren blumenfeld  don fanelli
TV Show,graves,nick nolte  sela ward  skylar astin,TV-MA,drama,TV Show TV-MA drama nick nolte  sela ward  skylar astin
TV Show,don't quit your gay job,rob easton  sean horlor,13+,tv shows,TV Show 13+ tv shows rob easton  sean horlor
TV Show,dan vs.,curtis armstrong  dave foley  paget brewster,TV-PG,"animation, comedy","TV Show TV-PG animation, comedy curtis armstrong  dave foley  paget brewster"
TV Show,himouto! umaru-chan,unknown,TV-14,anime,TV Show TV-14 anime unknown
TV Show,content,amy desrosiers  valentine rogers,TV-MA,"comedy, drama, science fiction","TV Show TV-MA comedy, drama, science fiction amy desrosiers  valentine rogers"
TV Show,the spot 313,brian white  marques houston  chrissy stokes,18+,"action, comedy","TV Show 18+ action, comedy brian white  marques houston  chrissy stokes"
TV Show,the coleman show,eric epps  khadijah freeman  cayen martin,13+,"comedy, drama","TV Show 13+ comedy, drama eric epps  khadijah freeman  cayen martin"
TV Show,tales from the cryptkeeper,john kassir,TV-G,"animation, kids","TV Show TV-G animation, kids john kassir"
TV Show,paranormal matrix,katie cook  cathy rankin,13+,tv shows,TV Show 13+ tv shows katie cook  cathy rankin
TV Show,mcmafia,james norton  aleksey serebryakov  caio blat,TV-MA,"drama, international, suspense","TV Show TV-MA drama, international, suspense james norton  aleksey serebryakov  caio blat"
TV Show,love and war,jay thomas  annie potts  joanna gleaon,TV-14,tv shows,TV Show TV-14 tv shows jay thomas  annie potts  joanna gleaon
TV Show,"eerie, indiana",mary-margaret humes  omri katz  justin shenkarow,TV-Y7,"comedy, drama, kids","TV Show TV-Y7 comedy, drama, kids mary-margaret humes  omri katz  justin shenkarow"
TV Show,the amethyst earring,anna kuzina  katerina tyshkevich  vladimir zayats,16+,drama,TV Show 16+ drama anna kuzina  katerina tyshkevich  vladimir zayats
TV Show,s.o.z: soldiers or zombies,sergio peris-mencheta  horacio garcía-rojas  toby schmitz,16+,suspense,TV Show 16+ suspense sergio peris-mencheta  horacio garcía-rojas  toby schmitz
TV Show,junichi,jun shison  mina fujii  mieko harada,13+,"drama, romance","TV Show 13+ drama, romance jun shison  mina fujii  mieko harada"
TV Show,dfw the series:traffickers,alexandria deberry  gabriela zas montero  jean machado,TV-MA,"action, drama, suspense","TV Show TV-MA action, drama, suspense alexandria deberry  gabriela zas montero  jean machado"
TV Show,a new leaf,daisy fuentes,TV-G,"documentary, kids, special interest","TV Show TV-G documentary, kids, special interest daisy fuentes"
TV Show,tayo's summer song series,unknown,ALL,"animation, kids","TV Show ALL animation, kids unknown"
TV Show,steve and maggie - sing and shout,steve r. watts  maggie,TV-G,"animation, kids","TV Show TV-G animation, kids steve r. watts  maggie"
TV Show,series before 1c onboarding - 7,1,18+,action,TV Show 18+ action 1
TV Show,more than a doctor,ekaterina semenova  andrei yegorov  sergey varchuk,16+,drama,TV Show 16+ drama ekaterina semenova  andrei yegorov  sergey varchuk
TV Show,is there anybody there?,chris howley  melissa williams,TV-MA,"documentary, drama, faith and spirituality","TV Show TV-MA documentary, drama, faith and spirituality chris howley  melissa williams"
TV Show,himote house,suzaki aya  akesaka satomi  mimori suzuko,13+,animation,TV Show 13+ animation suzaki aya  akesaka satomi  mimori suzuko
TV Show,weegies,stephen arthur  george charles stewart  matthew joseph-campbell,16+,comedy,TV Show 16+ comedy stephen arthur  george charles stewart  matthew joseph-campbell
TV Show,kids,fedor bavtrikov  rodion galyuchenko  mikhail khimichev,16+,drama,TV Show 16+ drama fedor bavtrikov  rodion galyuchenko  mikhail khimichev
TV Show,wrecking the uprising,peter coonan  owen mcdonnell,13+,drama,TV Show 13+ drama peter coonan  owen mcdonnell
TV Show,pirate treasure: 4k restored special edition,unknown,7+,action,TV Show 7+ action unknown
TV Show,the sneaker game,randie graves,18+,"special interest, unscripted","TV Show 18+ special interest, unscripted randie graves"
TV Show,postcards from...,alex smyth  laura bain  shelby travers,7+,action,TV Show 7+ action alex smyth  laura bain  shelby travers
TV Show,clip: act 3 series post 1c 2,1,ALL,tv shows,TV Show ALL tv shows 1
TV Show,cam & leon,unknown,ALL,"animation, comedy, kids","TV Show ALL animation, comedy, kids unknown"
TV Show,akedo: ultimate arcade warriors,unknown,ALL,"action, animation, kids","TV Show ALL action, animation, kids unknown"
TV Show,bazukuru,derek dj noxolo daphne jo,16+,comedy,TV Show 16+ comedy derek dj noxolo daphne jo
TV Show,hideaki anno: the final challenge of evangelion,unknown,TV-NR,documentary,TV Show TV-NR documentary unknown
TV Show,the g,william l. johnson  morocco omari  antoine mckay,18+,drama,TV Show 18+ drama william l. johnson  morocco omari  antoine mckay
TV Show,stand by me,yi cheng  yuxi zhang,18+,"drama, romance","TV Show 18+ drama, romance yi cheng  yuxi zhang"
TV Show,pete the cat,jacob tremblay  jeff “swampy” marsh  kt tunstall,ALL,kids,TV Show ALL kids jacob tremblay  jeff “swampy” marsh  kt tunstall
TV Show,let's enjoy kenya safari like a popular online tour!,unknown,TV-NR,documentary,TV Show TV-NR documentary unknown
TV Show,juhou 2405 reason of my death,ai takahashi,TV-NR,horror,TV Show TV-NR horror ai takahashi
TV Show,eternal love of dream,dilraba dilmurat  vengo gao  james li,13+,"drama, romance, science fiction","TV Show 13+ drama, romance, science fiction dilraba dilmurat  vengo gao  james li"
TV Show,dragon king legend .born disappeared martial soul,unknown,13+,animation,TV Show 13+ animation unknown
TV Show,court lady,li yi tong  xu kai  li ze feng,13+,"drama, romance","TV Show 13+ drama, romance li yi tong  xu kai  li ze feng"
TV Show,booba,artem kretov  elena solovieva  vyacheslav kataev,ALL,"animation, kids","TV Show ALL animation, kids artem kretov  elena solovieva  vyacheslav kataev"
TV Show,a river runs through it,ruichang wang  yixuan hu,18+,romance,TV Show 18+ romance ruichang wang  yixuan hu
TV Show,sing along with pinkfong & hogi,unknown,ALL,"animation, kids","TV Show ALL animation, kids unknown"
TV Show,sent in error,liza faley  aleksandr vedmensky  olga sumskaya,16+,drama,TV Show 16+ drama liza faley  aleksandr vedmensky  olga sumskaya
TV Show,atn's tribute to 100 years of indian cinema,unknown,ALL,"documentary, talk show and variety","TV Show ALL documentary, talk show and variety unknown"
TV Show,alien extinction,geovanni molina,16+,action,TV Show 16+ action geovanni molina
TV Show,ufo secret reports,geovanni molina,7+,science fiction,TV Show 7+ science fiction geovanni molina
TV Show,ray winstone's sicily,ray winstone,TV-14,special interest,TV Show TV-14 special interest ray winstone
TV Show,lularich,unknown,TV-14,documentary,TV Show TV-14 documentary unknown
TV Show,lol - enga siri paappom,padmashri vivek   shiva   abishek,16+,unscripted,TV Show 16+ unscripted padmashri vivek   shiva   abishek
TV Show,drag heals,tracey erin smith  kyle feistmantl  miles carney,TV-14,"arts, entertainment, and culture, documentary, lgbtq","TV Show TV-14 arts, entertainment, and culture, documentary, lgbtq tracey erin smith  kyle feistmantl  miles carney"
TV Show,shadow of justice,zhang zhilin  xue kaiqi  wang yangming,16+,"action, drama","TV Show 16+ action, drama zhang zhilin  xue kaiqi  wang yangming"
TV Show,ryan's world,ryan  mommy  daddy,ALL,tv shows,TV Show ALL tv shows ryan  mommy  daddy
TV Show,love mr right,han dong  jiang kaitong,13+,"comedy, drama","TV Show 13+ comedy, drama han dong  jiang kaitong"
TV Show,inference notes,zhang zifeng  hou minghao,16+,"adventure, drama, suspense","TV Show 16+ adventure, drama, suspense zhang zifeng  hou minghao"
TV Show,hot girl,dilireba  make,13+,drama,TV Show 13+ drama dilireba  make
TV Show,he who can't marry,hiroshi abe  you yoshida,TV-NR,"comedy, drama","TV Show TV-NR comedy, drama hiroshi abe  you yoshida"
TV Show,er doctors,zhang jiayi  wang luodan,13+,tv shows,TV Show 13+ tv shows zhang jiayi  wang luodan
TV Show,cocomong,jeong sunhye  yang jeonghwa  hong beomgi,ALL,"adventure, animation, kids","TV Show ALL adventure, animation, kids jeong sunhye  yang jeonghwa  hong beomgi"
TV Show,clip: run fox (english title),unknown,ALL,"animation, kids","TV Show ALL animation, kids unknown"
TV Show,a bite of shunde,unknown,ALL,tv shows,TV Show ALL tv shows unknown
TV Show,victoria small,unknown,TV-PG,drama,TV Show TV-PG drama unknown
TV Show,boris and rufus,unknown,ALL,"animation, kids","TV Show ALL animation, kids unknown"
TV Show,the secret of crickley hall,suranne jones  tom ellis  douglas henshall,16+,"drama, horror","TV Show 16+ drama, horror suranne jones  tom ellis  douglas henshall"
TV Show,pequeñas victorias,unknown,TV-PG,drama,TV Show TV-PG drama unknown
TV Show,lotus cup europe championship,unknown,TV-Y7,"documentary, sports","TV Show TV-Y7 documentary, sports unknown"
TV Show,hideaki anno and hitoshi matsumoto fireside chat,unknown,13+,documentary,TV Show 13+ documentary unknown
TV Show,alice in wonderland,kate dorning  ian wallace  jonathan cecil,7+,"kids, science fiction","TV Show 7+ kids, science fiction kate dorning  ian wallace  jonathan cecil"
TV Show,wayne,mark mckenna  ciara bravo,TV-MA,drama,TV Show TV-MA drama mark mckenna  ciara bravo
TV Show,the prisoner of zenda,malcolm sinclair  pauline moran  george irving,13+,"drama, romance","TV Show 13+ drama, romance malcolm sinclair  pauline moran  george irving"
TV Show,rogue,cole hauser  meaghan rath  ashley greene,TV-MA,"action, drama","TV Show TV-MA action, drama cole hauser  meaghan rath  ashley greene"
TV Show,rip the falcon,riley webber  max troutman  samspics,TV-MA,animation,TV Show TV-MA animation riley webber  max troutman  samspics
TV Show,def comedy jam,steve harvey  kid capri  james hannah,TV-MA,"arts, entertainment, and culture, comedy","TV Show TV-MA arts, entertainment, and culture, comedy steve harvey  kid capri  james hannah"
TV Show,death and compromise,brian elder  andrea flowers  john hall,16+,tv shows,TV Show 16+ tv shows brian elder  andrea flowers  john hall
TV Show,bill winston ministries draft,dr. bill winston,TV-G,"drama, faith and spirituality, special interest","TV Show TV-G drama, faith and spirituality, special interest dr. bill winston"
TV Show,sinbad,elliot knight  elliot cowan  marama corlett,13+,"action, science fiction","TV Show 13+ action, science fiction elliot knight  elliot cowan  marama corlett"
TV Show,raymond & miguel,raymond pozo  miguel céspedes  brasheli santos,TV-14,comedy,TV Show TV-14 comedy raymond pozo  miguel céspedes  brasheli santos
TV Show,now go build with werner vogels,dr. werner vogels,TV-G,"documentary, special interest","TV Show TV-G documentary, special interest dr. werner vogels"
TV Show,bluestone four two,oliver chris  gary carr  tony gardner,16+,comedy,TV Show 16+ comedy oliver chris  gary carr  tony gardner
TV Show,wallpaper,unknown,ALL,"documentary, special interest","TV Show ALL documentary, special interest unknown"
TV Show,the rev,tiny lister  jo-marie payton  john petritz,16+,comedy,TV Show 16+ comedy tiny lister  jo-marie payton  john petritz
TV Show,packed to the rafters,rebecca gibney  erik thomson  michael caton,13+,"comedy, drama, romance","TV Show 13+ comedy, drama, romance rebecca gibney  erik thomson  michael caton"
TV Show,mumbai diaries,mohit raina  konkona sen sharma  shreya dhanwanthary,16+,"drama, suspense","TV Show 16+ drama, suspense mohit raina  konkona sen sharma  shreya dhanwanthary"
TV Show,goliath,billy bob thornton  nina arianda  tania raymonde,TV-MA,"drama, suspense","TV Show TV-MA drama, suspense billy bob thornton  nina arianda  tania raymonde"
TV Show,gigglebug,santtu karvonen,ALL,"animation, kids","TV Show ALL animation, kids santtu karvonen"
TV Show,byron,jonny lee miller  vanessa redgrave  natasha little,18+,drama,TV Show 18+ drama jonny lee miller  vanessa redgrave  natasha little
