type,title,cast,rating,listed_in,combination
TV Show,secrets of the dead: the nero files,jay o. sanders,TV-PG,"documentary, special interest","TV Show TV-PG documentary, special interest jay o. sanders"
TV Show,secrets of the castle,ruth goodman  peter ginn  tom pinfold,13+,"documentary, special interest","TV Show 13+ documentary, special interest ruth goodman  peter ginn  tom pinfold"
TV Show,secret state,gabriel byrne  charles dance  gina mckee,TV-14,"drama, suspense","TV Show TV-14 drama, suspense gabriel byrne  charles dance  gina mckee"
TV Show,secret life of the hospital bed,joe duttine,16+,"documentary, special interest","TV Show 16+ documentary, special interest joe duttine"
TV Show,secret diary of a call girl,billie piper  iddo goldberg  cherie lunghi,18+,"drama, romance","TV Show 18+ drama, romance billie piper  iddo goldberg  cherie lunghi"
TV Show,second  war diary - the war day by day,unknown,TV-NR,"documentary, special interest","TV Show TV-NR documentary, special interest unknown"
TV Show,seatbelt psychic,lisa cash  thomas john,TV-PG,"documentary, drama, unscripted","TV Show TV-PG documentary, drama, unscripted lisa cash  thomas john"
TV Show,sea power,unknown,7+,documentary,TV Show 7+ documentary unknown
TV Show,scrubs,zach braff  donald faison  sarah chalke,TV-14,comedy,TV Show TV-14 comedy zach braff  donald faison  sarah chalke
TV Show,scrapyard supercar,shane lynch  ralph hosier,7+,"special interest, unscripted","TV Show 7+ special interest, unscripted shane lynch  ralph hosier"
TV Show,scott & bailey,suranne jones  lesley sharp,TV-14,"drama, suspense","TV Show TV-14 drama, suspense suranne jones  lesley sharp"
TV Show,scigirls,unknown,NR,kids,TV Show NR kids unknown
TV Show,scenic walks around the world,michael lumsden,ALL,tv shows,TV Show ALL tv shows michael lumsden
TV Show,scenery channel,unknown,ALL,"international, special interest","TV Show ALL international, special interest unknown"
TV Show,scaredy squirrel,terry mcgurrin  jonathan gould  pat mckenna,TV-G,"animation, kids","TV Show TV-G animation, kids terry mcgurrin  jonathan gould  pat mckenna"
TV Show,sas rogue warriors,unknown,TV-PG,"documentary, military and war, special interest","TV Show TV-PG documentary, military and war, special interest unknown"
TV Show,salvage: code red,unknown,13+,"adventure, documentary, special interest","TV Show 13+ adventure, documentary, special interest unknown"
TV Show,sagrada reset,unknown,TV-14,"anime, drama","TV Show TV-14 anime, drama unknown"
TV Show,ruyi's royal love in the palace,zhou xun  huo jianhua,13+,drama,TV Show 13+ drama zhou xun  huo jianhua
TV Show,russell peters: deported,russell peters,16+,"arts, entertainment, and culture, comedy","TV Show 16+ arts, entertainment, and culture, comedy russell peters"
TV Show,runaway squad,unknown,TV-14,tv shows,TV Show TV-14 tv shows unknown
TV Show,rubbadubbers,john gordon sinclair  sean hughes  maria darling,TV-Y,kids,TV Show TV-Y kids john gordon sinclair  sean hughes  maria darling
TV Show,ross kemp: middle east,ross kemp,16+,tv shows,TV Show 16+ tv shows ross kemp
TV Show,rose and maloney,sarah lancashire  phil davis  tara fitzgerald,13+,"drama, suspense","TV Show 13+ drama, suspense sarah lancashire  phil davis  tara fitzgerald"
TV Show,room at the top,matthew mcnulty  maxine peake  jenna louise coleman,18+,tv shows,TV Show 18+ tv shows matthew mcnulty  maxine peake  jenna louise coleman
TV Show,"ronja, the robber's daughter",gillian anderson  theresa gallagher,7+,"anime, kids","TV Show 7+ anime, kids gillian anderson  theresa gallagher"
TV Show,rome - empire without limit,mary beard,16+,"documentary, special interest","TV Show 16+ documentary, special interest mary beard"
TV Show,rolie polie olie,cole caplan  adrian truss  kristen bone,TV-Y,"animation, kids","TV Show TV-Y animation, kids cole caplan  adrian truss  kristen bone"
TV Show,rodeo girls,darcy lapier  jessica holmberg  megan etcheberry,TV-14,tv shows,TV Show TV-14 tv shows darcy lapier  jessica holmberg  megan etcheberry
TV Show,rocky and bullwinkle,tara strong as rocky  ben diskin as boris  rachel butera as natasha,7+,kids,TV Show 7+ kids tara strong as rocky  ben diskin as boris  rachel butera as natasha
TV Show,rob delaney: jackie,rob delaney,18+,"arts, entertainment, and culture, comedy","TV Show 18+ arts, entertainment, and culture, comedy rob delaney"
TV Show,ritual,unknown,TV-NR,"comedy, documentary, sports","TV Show TV-NR comedy, documentary, sports unknown"
TV Show,rick steves' europe,rick steves,TV-G,"documentary, special interest","TV Show TV-G documentary, special interest rick steves"
TV Show,rick stein's mediterranean escapes,rick stein,TV-PG,special interest,TV Show TV-PG special interest rick stein
TV Show,rick stein's long weekends,rick stein,TV-PG,special interest,TV Show TV-PG special interest rick stein
TV Show,rick stein's india,rick stein,13+,special interest,TV Show 13+ special interest rick stein
TV Show,rick stein's far eastern odyssey,rick stein,13+,special interest,TV Show 13+ special interest rick stein
TV Show,richard simmons' dream maker,richard simmons,ALL,special interest,TV Show ALL special interest richard simmons
TV Show,richard hammond's crash course,richard hammond,13+,"documentary, special interest","TV Show 13+ documentary, special interest richard hammond"
TV Show,rich africans,michael blackson  femi lawson  young joc,13+,comedy,TV Show 13+ comedy michael blackson  femi lawson  young joc
TV Show,rhythms of faith,mecca morphosis  omar farooq  dan blake,13+,drama,TV Show 13+ drama mecca morphosis  omar farooq  dan blake
TV Show,rex the runt,unknown,TV-PG,comedy,TV Show TV-PG comedy unknown
TV Show,rev & roll,unknown,TV-Y,"animation, kids","TV Show TV-Y animation, kids unknown"
TV Show,return to the mackenzie - expedition overland,clay croft  ty heaps  kurt williams,TV-PG,"action, documentary, special interest","TV Show TV-PG action, documentary, special interest clay croft  ty heaps  kurt williams"
TV Show,rescue special ops,daniel amalm  gigi edgley  katherine hicks,16+,"action, drama","TV Show 16+ action, drama daniel amalm  gigi edgley  katherine hicks"
TV Show,requiem from the darkness (english dub),grant george  steve kramer  karen strassman,18+,"animation, anime, horror","TV Show 18+ animation, anime, horror grant george  steve kramer  karen strassman"
TV Show,regular heroes,alicia keys  j.j. watt  chelsea phaire,13+,unscripted,TV Show 13+ unscripted alicia keys  j.j. watt  chelsea phaire
TV Show,redakai: lokar's shadow,marc bretonnière  austin dilulio,TV-Y7,"animation, kids","TV Show TV-Y7 animation, kids marc bretonnière  austin dilulio"
TV Show,red rock,andrea irvine  patrick ryan  cathy belton,18+,tv shows,TV Show 18+ tv shows andrea irvine  patrick ryan  cathy belton
TV Show,real love stories from around the world: united states - love stories tv,unknown,ALL,"documentary, special interest","TV Show ALL documentary, special interest unknown"
TV Show,real crime chronicles,unknown,16+,"documentary, special interest","TV Show 16+ documentary, special interest unknown"
TV Show,ready jet go!,unknown,TV-Y,kids,TV Show TV-Y kids unknown
TV Show,reading rainbow,unknown,TV-Y,kids,TV Show TV-Y kids unknown
TV Show,reading egg's the eggsperts,unknown,ALL,"animation, kids","TV Show ALL animation, kids unknown"
TV Show,re:creators,daiki yamashita  mikako komatsu  inori minase,TV-NR,anime,TV Show TV-NR anime daiki yamashita  mikako komatsu  inori minase
TV Show,rasbhari (4k uhd),swara bhasker  ayushmaan saxena  rashmi agdekar,16+,"comedy, drama","TV Show 16+ comedy, drama swara bhasker  ayushmaan saxena  rashmi agdekar"
TV Show,rasbhari,swara bhasker  ayushmaan saxena  rashmi agdekar,16+,"comedy, drama","TV Show 16+ comedy, drama swara bhasker  ayushmaan saxena  rashmi agdekar"
TV Show,rakuen the secret of paradise,kazuyoshi miyoshi,TV-NR,documentary,TV Show TV-NR documentary kazuyoshi miyoshi
TV Show,raising asia,asia ray monet  bill hufsey,TV-PG,tv shows,TV Show TV-PG tv shows asia ray monet  bill hufsey
TV Show,rainbow ruby,unknown,TV-Y,"animation, kids","TV Show TV-Y animation, kids unknown"
TV Show,rain shadow,rachel ward  grant piro  victoria thaine,13+,drama,TV Show 13+ drama rachel ward  grant piro  victoria thaine
TV Show,rage of bahamut virgin soul,sumire morohoshi  yuuichirou umehara  hiroyuki yoshino,TV-NR,anime,TV Show TV-NR anime sumire morohoshi  yuuichirou umehara  hiroyuki yoshino
TV Show,rachel allen's everyday kitchen,rachel allen,TV-PG,special interest,TV Show TV-PG special interest rachel allen
TV Show,queer·ious | the series,"alexander ""lex"" king  darxia morris  cole lawson",18+,"drama, lgbtq","TV Show 18+ drama, lgbtq alexander ""lex"" king  darxia morris  cole lawson"
TV Show,queer as folk,aidan gillen  craig kelly  charlie hunnam,18+,"drama, lgbtq","TV Show 18+ drama, lgbtq aidan gillen  craig kelly  charlie hunnam"
TV Show,quark science,unknown,7+,tv shows,TV Show 7+ tv shows unknown
TV Show,qin dynasty epic,zhang luyi  duan yihong  li naiwen,13+,"action, drama","TV Show 13+ action, drama zhang luyi  duan yihong  li naiwen"
TV Show,qb vii,ben gazzara  anthony hopkins  leslie caron,13+,"drama, suspense","TV Show 13+ drama, suspense ben gazzara  anthony hopkins  leslie caron"
TV Show,python for everybody,dr. charles russell severance,unknown,special interest,TV Show unknown special interest dr. charles russell severance
TV Show,pushpavalli (telugu),sumukhi suresh  naveen richard  manish anand,TV-NR,"comedy, drama","TV Show TV-NR comedy, drama sumukhi suresh  naveen richard  manish anand"
TV Show,pushpavalli (tamil),sumukhi suresh  naveen richard  manish anand,TV-NR,"comedy, drama","TV Show TV-NR comedy, drama sumukhi suresh  naveen richard  manish anand"
TV Show,pushpavalli,sumukhi suresh  naveen richard  manish anand,16+,"comedy, drama","TV Show 16+ comedy, drama sumukhi suresh  naveen richard  manish anand"
TV Show,public enemies,daniel mays  anna friel  lorraine ashbourne,16+,drama,TV Show 16+ drama daniel mays  anna friel  lorraine ashbourne
TV Show,psycho-pass (sub),arata shindo:yuki kaji  kei mikhail ignatov:yuichi nakamura,NR,tv shows,TV Show NR tv shows arata shindo:yuki kaji  kei mikhail ignatov:yuichi nakamura
TV Show,psychic tia,unknown,TV-14,tv shows,TV Show TV-14 tv shows unknown
TV Show,psychic princess,ranyinruocai  lu lifengdk  wang chong,13+,"animation, anime","TV Show 13+ animation, anime ranyinruocai  lu lifengdk  wang chong"
TV Show,psychic kids: children of the paranormal,chip coffey,TV-PG,"documentary, drama, unscripted","TV Show TV-PG documentary, drama, unscripted chip coffey"
TV Show,psychic intervention,unknown,TV-PG,tv shows,TV Show TV-PG tv shows unknown
TV Show,psych,james roday  dule hill  corbin bernsen,TV-PG,"comedy, suspense","TV Show TV-PG comedy, suspense james roday  dule hill  corbin bernsen"
TV Show,project restoration,marianne suhr  griff rhys jones  ptolemy dean,7+,"special interest, unscripted","TV Show 7+ special interest, unscripted marianne suhr  griff rhys jones  ptolemy dean"
TV Show,prisoners' wives,pippa haywood  polly walker  phoebe dynevor,18+,drama,TV Show 18+ drama pippa haywood  polly walker  phoebe dynevor
TV Show,princess principal,unknown,TV-14,"action, adventure, anime","TV Show TV-14 action, adventure, anime unknown"
TV Show,prime suspect: tennison,unknown,TV-14,"drama, historical, suspense","TV Show TV-14 drama, historical, suspense unknown"
TV Show,prime rewind: inside the boys,aisha tyler  karl urban  laz alonso,18+,talk show and variety,TV Show 18+ talk show and variety aisha tyler  karl urban  laz alonso
TV Show,prime japan [hd/sd ver] (english subtitled),jonathan sherr,TV-NR,documentary,TV Show TV-NR documentary jonathan sherr
TV Show,prime japan (4k uhd),jonathan sherr,ALL,tv shows,TV Show ALL tv shows jonathan sherr
TV Show,primal grill with steven raichlen,steven raichlen,TV-G,special interest,TV Show TV-G special interest steven raichlen
TV Show,prey,philip glenister  rosie cavaliero,TV-14,"drama, suspense","TV Show TV-14 drama, suspense philip glenister  rosie cavaliero"
TV Show,presunto culpable,miguel angel muñoz  susi sanchez  elvira minguez,NR,"drama, suspense","TV Show NR drama, suspense miguel angel muñoz  susi sanchez  elvira minguez"
TV Show,press your luck,peter tomarken,TV-G,unscripted,TV Show TV-G unscripted peter tomarken
TV Show,preachers' daughters,audrey perry  cheryl perry,TV-PG,"drama, unscripted","TV Show TV-PG drama, unscripted audrey perry  cheryl perry"
TV Show,pramface,sean michael verey  scarlett alice johnson  angus deayton,TV-14,"comedy, young adult audience","TV Show TV-14 comedy, young adult audience sean michael verey  scarlett alice johnson  angus deayton"
TV Show,postcards from buster,unknown,TV-Y,kids,TV Show TV-Y kids unknown
TV Show,police rescue,gary sweet  sonia todd  steve bastoni,16+,"action, drama","TV Show 16+ action, drama gary sweet  sonia todd  steve bastoni"
TV Show,poldark,aidan turner  eleanor tomlinson  ellise chappell,18+,"drama, historical","TV Show 18+ drama, historical aidan turner  eleanor tomlinson  ellise chappell"
TV Show,pokémon the series: gold and silver,ikue ohtani  veronica taylor,TV-Y7,"anime, kids","TV Show TV-Y7 anime, kids ikue ohtani  veronica taylor"
TV Show,pointless celebrities,alexander armstrong  richard osman,7+,"special interest, unscripted","TV Show 7+ special interest, unscripted alexander armstrong  richard osman"
TV Show,pocket.watch onyx family ultimate mishmash,mirthell mitchell  rita mitchell  shalom mitchell,TV-Y7,kids,TV Show TV-Y7 kids mirthell mitchell  rita mitchell  shalom mitchell
TV Show,plim plim,unknown,ALL,"animation, kids","TV Show ALL animation, kids unknown"
TV Show,playful kiss,kim hyun-joong  jung so-min  lee tae-sung,13+,"comedy, drama, romance","TV Show 13+ comedy, drama, romance kim hyun-joong  jung so-min  lee tae-sung"
TV Show,planet egypt,unknown,TV-14,documentary,TV Show TV-14 documentary unknown
TV Show,pistorius,unknown,13+,tv shows,TV Show 13+ tv shows unknown
TV Show,pinkfong! wash your hands with baby shark,unknown,ALL,"animation, kids","TV Show ALL animation, kids unknown"
TV Show,pinkfong! times tables songs,unknown,ALL,kids,TV Show ALL kids unknown
TV Show,pinkfong! time songs,unknown,ALL,"animation, kids","TV Show ALL animation, kids unknown"
TV Show,pinkfong! shape songs,unknown,ALL,"animation, kids","TV Show ALL animation, kids unknown"
TV Show,pinkfong! poki's toy lab,unknown,ALL,"animation, kids","TV Show ALL animation, kids unknown"
TV Show,pinkfong! outer space songs,unknown,ALL,"animation, kids","TV Show ALL animation, kids unknown"
TV Show,pinkfong! number songs,unknown,ALL,"animation, kids","TV Show ALL animation, kids unknown"
TV Show,pinkfong! learn colors with hogi,unknown,ALL,"animation, kids","TV Show ALL animation, kids unknown"
TV Show,"pinkfong! hogi, the detective",unknown,ALL,"animation, kids","TV Show ALL animation, kids unknown"
TV Show,pinkfong! halloween songs,unknown,ALL,"animation, kids","TV Show ALL animation, kids unknown"
TV Show,pinkfong! fun rhyming songs,unknown,ALL,"animation, kids","TV Show ALL animation, kids unknown"
TV Show,pinkfong! fruit songs,unknown,ALL,"animation, kids","TV Show ALL animation, kids unknown"
TV Show,pinkfong! dinosaur songs (spanish version),unknown,ALL,"animation, kids","TV Show ALL animation, kids unknown"
TV Show,pinkfong! dinosaur musical stories,unknown,ALL,"animation, kids","TV Show ALL animation, kids unknown"
TV Show,pinkfong! coloring with hogi,unknown,ALL,"animation, kids","TV Show ALL animation, kids unknown"
TV Show,pinkfong! christmas carols,unknown,ALL,"animation, kids","TV Show ALL animation, kids unknown"
TV Show,pinkfong! car songs (spanish version),unknown,ALL,"animation, kids","TV Show ALL animation, kids unknown"
TV Show,pinkfong! car songs,unknown,ALL,"animation, kids","TV Show ALL animation, kids unknown"
TV Show,pinkfong! body songs,unknown,ALL,"animation, kids","TV Show ALL animation, kids unknown"
TV Show,pinkfong! best kids songs,unknown,ALL,kids,TV Show ALL kids unknown
TV Show,pinkfong! bedtime lullabies,unknown,ALL,"animation, kids","TV Show ALL animation, kids unknown"
TV Show,pinkfong! baby shark's day at home,unknown,ALL,"animation, kids","TV Show ALL animation, kids unknown"
TV Show,pinkfong! baby shark special (spanish version),unknown,ALL,"animation, kids","TV Show ALL animation, kids unknown"
TV Show,pinkfong! baby shark special,unknown,ALL,kids,TV Show ALL kids unknown
TV Show,pinkfong! baby shark sing along,unknown,ALL,"animation, kids","TV Show ALL animation, kids unknown"
TV Show,pinkfong! baby shark nursery rhymes,unknown,ALL,"animation, kids","TV Show ALL animation, kids unknown"
TV Show,pinkfong! baby shark & more animal songs (spanish version),unknown,ALL,"animation, kids","TV Show ALL animation, kids unknown"
TV Show,pinkfong! baby shark & halloween songs,unknown,ALL,"animation, kids","TV Show ALL animation, kids unknown"
TV Show,pinkfong! baby shark & christmas songs,unknown,ALL,"animation, kids","TV Show ALL animation, kids unknown"
TV Show,pingu,marcello magni  david sant,TV-Y,"animation, kids","TV Show TV-Y animation, kids marcello magni  david sant"
TV Show,picnic at hanging rock,natalie dormer  lily sullivan  lola bessis,16+,drama,TV Show 16+ drama natalie dormer  lily sullivan  lola bessis
TV Show,picker sisters,unknown,TV-14,"special interest, unscripted","TV Show TV-14 special interest, unscripted unknown"
TV Show,phonics school,unknown,ALL,"animation, kids, special interest","TV Show ALL animation, kids, special interest unknown"
TV Show,philip k. dick's electric dreams,terrence howard  bryan cranston  anna paquin,18+,"drama, science fiction","TV Show 18+ drama, science fiction terrence howard  bryan cranston  anna paquin"
TV Show,peter allen: not the boy next door,joe jackson  rebecca gibney  sara west,18+,tv shows,TV Show 18+ tv shows joe jackson  rebecca gibney  sara west
TV Show,peppa pig,john sparkes  morwenna banks  richard ridings,TV-Y,kids,TV Show TV-Y kids john sparkes  morwenna banks  richard ridings
TV Show,people like us,chris langham,16+,comedy,TV Show 16+ comedy chris langham
TV Show,peg + cat,unknown,TV-Y,kids,TV Show TV-Y kids unknown
TV Show,peep time,shingo katori  jiro sato  chihiro yamamoto,16+,"comedy, kids, talk show and variety","TV Show 16+ comedy, kids, talk show and variety shingo katori  jiro sato  chihiro yamamoto"
TV Show,peep and the big wide world,unknown,TV-Y,kids,TV Show TV-Y kids unknown
TV Show,peekaboo i see you series,unknown,ALL,"animation, kids","TV Show ALL animation, kids unknown"
TV Show,pawn stars,unknown,TV-14,"special interest, unscripted","TV Show TV-14 special interest, unscripted unknown"
TV Show,paula's home cooking,unknown,TV-G,special interest,TV Show TV-G special interest unknown
TV Show,paul chowdhry live innit (4k uhd),unknown,18+,tv shows,TV Show 18+ tv shows unknown
TV Show,paul chowdhry live innit,unknown,18+,tv shows,TV Show 18+ tv shows unknown
TV Show,patriot,chris conrad  kurtwood smith  michael dorman,18+,"drama, suspense","TV Show 18+ drama, suspense chris conrad  kurtwood smith  michael dorman"
TV Show,patrick melrose,benedict cumberbatch  jennifer jason leigh  hugo weaving,TV-MA,drama,TV Show TV-MA drama benedict cumberbatch  jennifer jason leigh  hugo weaving
TV Show,pati's mexican table,pati jinich,ALL,special interest,TV Show ALL special interest pati jinich
TV Show,password plus,allen ludden,TV-G,unscripted,TV Show TV-G unscripted allen ludden
TV Show,parry gripp video mega-party,parry gripp,ALL,"comedy, kids","TV Show ALL comedy, kids parry gripp"
TV Show,parking wars,unknown,TV-14,tv shows,TV Show TV-14 tv shows unknown
TV Show,paranormal cops,ron fabiani,TV-PG,"documentary, drama, unscripted","TV Show TV-PG documentary, drama, unscripted ron fabiani"
TV Show,paradox,tamzin outhwaite  emun elliott,TV-PG,tv shows,TV Show TV-PG tv shows tamzin outhwaite  emun elliott
TV Show,panic 9-1-1,unknown,TV-14,tv shows,TV Show TV-14 tv shows unknown
TV Show,pandora,priscilla quintana  raechelle banno  martin bobb-semple,TV-NR,"action, adventure, drama","TV Show TV-NR action, adventure, drama priscilla quintana  raechelle banno  martin bobb-semple"
TV Show,panchayat (4k uhd),jitendra kumar  neena gupta  raghubir yadav,13+,tv shows,TV Show 13+ tv shows jitendra kumar  neena gupta  raghubir yadav
TV Show,panchayat,jitendra kumar  neena gupta  raghubir yadav,13+,tv shows,TV Show 13+ tv shows jitendra kumar  neena gupta  raghubir yadav
TV Show,pajanimals,victor yerrid  sarah lyle  michael winsor,TV-Y,kids,TV Show TV-Y kids victor yerrid  sarah lyle  michael winsor
TV Show,paatal lok,jaideep ahlawat  neeraj kabi  gul panag,18+,"drama, international","TV Show 18+ drama, international jaideep ahlawat  neeraj kabi  gul panag"
TV Show,owlegories,holly franklin  jaden roberts  mary morgan,ALL,"animation, faith and spirituality, kids","TV Show ALL animation, faith and spirituality, kids holly franklin  jaden roberts  mary morgan"
TV Show,out on stage (the series),zach noe towers  brendan scannell  jared goldstein,18+,tv shows,TV Show 18+ tv shows zach noe towers  brendan scannell  jared goldstein
TV Show,our girl,michelle keegan  ben aldridge  simon lennon,16+,"action, drama","TV Show 16+ action, drama michelle keegan  ben aldridge  simon lennon"
TV Show,orphan black (4k uhd),tatiana maslany  jordan gavaris  maria doyle kennedy,TV-MA,"drama, science fiction","TV Show TV-MA drama, science fiction tatiana maslany  jordan gavaris  maria doyle kennedy"
TV Show,orphan black,tatiana maslany  jordan gavaris  kevin hanchard,TV-MA,"drama, science fiction","TV Show TV-MA drama, science fiction tatiana maslany  jordan gavaris  kevin hanchard"
TV Show,only in america with larry the cable guy,eric weingrad,TV-14,"documentary, drama, unscripted","TV Show TV-14 documentary, drama, unscripted eric weingrad"
TV Show,onihei,kenyu horiuchi  daisuke namikawa  romi pak,TV-NR,anime,TV Show TV-NR anime kenyu horiuchi  daisuke namikawa  romi pak
TV Show,one on one,flex alexander  kyla pratt  robert ri'chard,TV-G,comedy,TV Show TV-G comedy flex alexander  kyla pratt  robert ri'chard
TV Show,one mississippi,tig notaro  noah harpster  john rothman,18+,comedy,TV Show 18+ comedy tig notaro  noah harpster  john rothman
TV Show,one mic stand,sapan verma  bhuvan bam  taapsee pannu,16+,"arts, entertainment, and culture, comedy, international","TV Show 16+ arts, entertainment, and culture, comedy, international sapan verma  bhuvan bam  taapsee pannu"
TV Show,one child,katie leung  linh-dan pham  donald sumpter,TV-MA,drama,TV Show TV-MA drama katie leung  linh-dan pham  donald sumpter
TV Show,off the cuff,chris parr  harris dirnberger  philip dirnberger,16+,"documentary, special interest","TV Show 16+ documentary, special interest chris parr  harris dirnberger  philip dirnberger"
TV Show,oddbods,unknown,ALL,"animation, comedy, kids","TV Show ALL animation, comedy, kids unknown"
TV Show,odd squad,dalila bela  filip geljo  millie davis,TV-Y,kids,TV Show TV-Y kids dalila bela  filip geljo  millie davis
TV Show,o.j. speaks: the hidden tapes,unknown,TV-14,"documentary, special interest","TV Show TV-14 documentary, special interest unknown"
TV Show,nursery ryhmes for babies,unknown,ALL,"animation, kids","TV Show ALL animation, kids unknown"
TV Show,nursery rhymes with color crew (spanish audio),unknown,ALL,"animation, kids","TV Show ALL animation, kids unknown"
TV Show,nursery rhymes and kids songs by kiiyii (made by little baby bum),unknown,ALL,kids,TV Show ALL kids unknown
TV Show,numbers parade series,unknown,ALL,"animation, kids, special interest","TV Show ALL animation, kids, special interest unknown"
TV Show,nova: worlds fastest animal,unknown,TV-PG,tv shows,TV Show TV-PG tv shows unknown
TV Show,nova: volatile earth - volcano on fire,parker sawyers,TV-PG,tv shows,TV Show TV-PG tv shows parker sawyers
TV Show,nova: last b-24,unknown,TV-PG,"documentary, special interest","TV Show TV-PG documentary, special interest unknown"
TV Show,niko and the sword of light,アンドレ･ロビンソン  カリ･ワールグレン  トム･ケニー,ALL,kids,TV Show ALL kids アンドレ･ロビンソン  カリ･ワールグレン  トム･ケニー
TV Show,nicole & jionni's shore flip,jionni lavalle  nicole polizzi,13+,"documentary, drama, unscripted","TV Show 13+ documentary, drama, unscripted jionni lavalle  nicole polizzi"
TV Show,new york goes to work,tiffany pollard,18+,tv shows,TV Show 18+ tv shows tiffany pollard
TV Show,new york goes to hollywood,tiffany pollard,16+,"comedy, special interest, unscripted","TV Show 16+ comedy, special interest, unscripted tiffany pollard"
TV Show,new words with joey's toy box series,unknown,ALL,"kids, special interest","TV Show ALL kids, special interest unknown"
TV Show,new england legends,jeff belanger,TV-PG,"documentary, horror, special interest","TV Show TV-PG documentary, horror, special interest jeff belanger"
TV Show,nazi attack on america,unknown,13+,"documentary, special interest","TV Show 13+ documentary, special interest unknown"
TV Show,nature cat,unknown,TV-Y,"animation, kids","TV Show TV-Y animation, kids unknown"
TV Show,napoleon: the man who would rule europe,unknown,13+,"documentary, special interest","TV Show 13+ documentary, special interest unknown"
TV Show,napoleon hill's master key,napoleon hill  w. clement stone,NR,special interest,TV Show NR special interest napoleon hill  w. clement stone
TV Show,mysteryquest,stan bernard,TV-14,"documentary, special interest","TV Show TV-14 documentary, special interest stan bernard"
TV Show,my restaurant rules australia,caterina borsato  patrick collins  matt moran,7+,"special interest, unscripted","TV Show 7+ special interest, unscripted caterina borsato  patrick collins  matt moran"
TV Show,my paranormal nightmare,unknown,18+,"documentary, horror","TV Show 18+ documentary, horror unknown"
