type,title,cast,rating,listed_in,combination
TV Show,zoo babies,narrator - gillian barlett,ALL,"kids, special interest","TV Show ALL kids, special interest narrator - gillian barlett"
TV Show,zoë coombs marr: bossy bottom,zoë coombs marr,18+,"comedy, talk show and variety","TV Show 18+ comedy, talk show and variety zoë coombs marr"
TV Show,zoboomafoo,unknown,TV-Y,kids,TV Show TV-Y kids unknown
TV Show,zo zo zombie: mini-series,alex cazares  ben diskin  cristina vee,TV-Y7,"action, anime, comedy","TV Show TV-Y7 action, anime, comedy alex cazares  ben diskin  cristina vee"
TV Show,zerozerozero,andrea riseborough  harold torres  claudia pineda,18+,tv shows,TV Show 18+ tv shows andrea riseborough  harold torres  claudia pineda
TV Show,zahara: the return,natasha heschélle  curtis morgan  hannah scott,16+,tv shows,TV Show 16+ tv shows natasha heschélle  curtis morgan  hannah scott
TV Show,z: the beginning of everything,christina ricci    david hoflin,18+,"comedy, drama","TV Show 18+ comedy, drama christina ricci    david hoflin"
TV Show,yu-gi-oh! zexal,eli jay  marc thompson  sean schemmel,TV-Y7,"animation, anime, fantasy","TV Show TV-Y7 animation, anime, fantasy eli jay  marc thompson  sean schemmel"
TV Show,yu-gi-oh! arc-v,michael liscio jr.  emily bauer,TV-Y7,"action, adventure, animation","TV Show TV-Y7 action, adventure, animation michael liscio jr.  emily bauer"
TV Show,yu-gi-oh! 5d's,gregory abbey  bella hudson  ed paul,TV-Y7,"anime, kids","TV Show TV-Y7 anime, kids gregory abbey  bella hudson  ed paul"
TV Show,your bleeped up brain,dobrokhotova ekaterina  mike new,TV-PG,tv shows,TV Show TV-PG tv shows dobrokhotova ekaterina  mike new
TV Show,young lions,alex dimitriades  alexandra davies  tom long,16+,"drama, suspense","TV Show 16+ drama, suspense alex dimitriades  alexandra davies  tom long"
TV Show,"yoga therapy for back pain, neck pain & stress relief - lindsey samper",lindsey samper,ALL,fitness,TV Show ALL fitness lindsey samper
TV Show,yearly departed,phoebe robinson  rachel brosnahan  tiffany haddish,16+,"arts, entertainment, and culture, comedy, talk show and variety","TV Show 16+ arts, entertainment, and culture, comedy, talk show and variety phoebe robinson  rachel brosnahan  tiffany haddish"
TV Show,yancy derringer,jock mahoney  x brands  kevin hagen,13+,"action, western","TV Show 13+ action, western jock mahoney  x brands  kevin hagen"
TV Show,xploration earth 2050,chuck pell,ALL,"documentary, science fiction","TV Show ALL documentary, science fiction chuck pell"
TV Show,xiaolin chronicles,tara strong  jennifer hale  eric bauza,7+,"adventure, animation, kids","TV Show 7+ adventure, animation, kids tara strong  jennifer hale  eric bauza"
TV Show,wwii in hd,gary sinise  charles scheffel,TV-14,action,TV Show TV-14 action gary sinise  charles scheffel
TV Show,wpc 56,wpc annie taylor  charles de'ath  olly rix,13+,"drama, romance, suspense","TV Show 13+ drama, romance, suspense wpc annie taylor  charles de'ath  olly rix"
TV Show,would i lie to you?,david mitchell  lee mack  rob brydon,TV-PG,"comedy, special interest, unscripted","TV Show TV-PG comedy, special interest, unscripted david mitchell  lee mack  rob brydon"
TV Show,wotakoi: love is hard for otaku,arisa date  kent ito  miyuki sawashiro,TV-NR,tv shows,TV Show TV-NR tv shows arisa date  kent ito  miyuki sawashiro
TV Show,world’s toughest race: eco-challenge fiji,bear grylls,13+,unscripted,TV Show 13+ unscripted bear grylls
TV Show,world war ii: when lions roared,michael caine  john lithgow  bob hoskins,TV-14,drama,TV Show TV-14 drama michael caine  john lithgow  bob hoskins
TV Show,world war 2 - the call of duty: a complete timeline,liam dale,13+,"documentary, military and war","TV Show 13+ documentary, military and war liam dale"
TV Show,world food championships,tiffany derry,TV-PG,tv shows,TV Show TV-PG tv shows tiffany derry
TV Show,wordworld,unknown,TV-G,kids,TV Show TV-G kids unknown
TV Show,wordgirl,unknown,TV-G,kids,TV Show TV-G kids unknown
TV Show,wonders of mexico,anthony mendez,TV-G,"documentary, special interest","TV Show TV-G documentary, special interest anthony mendez"
TV Show,wonder balls,unknown,ALL,"animation, kids","TV Show ALL animation, kids unknown"
TV Show,wishenpoof,addison holley  hope cassandra  scott mccord,ALL,kids,TV Show ALL kids addison holley  hope cassandra  scott mccord
TV Show,wisconsin unexplained,michael butt,16+,tv shows,TV Show 16+ tv shows michael butt
TV Show,wipeout canada,ennis esmer  jonathan torrens  jessica phillips,ALL,"comedy, documentary, unscripted","TV Show ALL comedy, documentary, unscripted ennis esmer  jonathan torrens  jessica phillips"
TV Show,wipeout australia,james brayshaw  josh lawson  kelly landry,7+,"comedy, documentary, unscripted","TV Show 7+ comedy, documentary, unscripted james brayshaw  josh lawson  kelly landry"
TV Show,wildest places,unknown,ALL,"documentary, special interest","TV Show ALL documentary, special interest unknown"
TV Show,wild north,unknown,7+,"documentary, special interest","TV Show 7+ documentary, special interest unknown"
TV Show,wild kratts,chris kratt  martin kratt  athena karkanis,TV-Y,kids,TV Show TV-Y kids chris kratt  martin kratt  athena karkanis
TV Show,wild boys,daniel macpherson  michael dorman  alexander england,13+,"drama, western","TV Show 13+ drama, western daniel macpherson  michael dorman  alexander england"
TV Show,why i ran,unknown,TV-PG,tv shows,TV Show TV-PG tv shows unknown
TV Show,whitechapel,rupert penry-jones  phil davis  steve pemberton,TV-14,"drama, suspense","TV Show TV-14 drama, suspense rupert penry-jones  phil davis  steve pemberton"
TV Show,white dragon,john simm  anthony wang  emilia fox,16+,drama,TV Show 16+ drama john simm  anthony wang  emilia fox
TV Show,what's up in space: the solar system for kids,unknown,TV-G,"documentary, kids, special interest","TV Show TV-G documentary, kids, special interest unknown"
TV Show,what's my line?,john daly,TV-G,unscripted,TV Show TV-G unscripted john daly
TV Show,what went wrong: countdown to catastrophe,john young,13+,"documentary, special interest","TV Show 13+ documentary, special interest john young"
TV Show,what the constitution means to me,heidi schreck  mike iveson  rosdely ciprian,16+,comedy,TV Show 16+ comedy heidi schreck  mike iveson  rosdely ciprian
TV Show,wgc-dell technologies match play reveal show,unknown,TV-NR,sports,TV Show TV-NR sports unknown
TV Show,wendy,christa clahane  abbe hoekstra  zena drive,ALL,"animation, kids","TV Show ALL animation, kids christa clahane  abbe hoekstra  zena drive"
TV Show,welliewishers,unknown,ALL,kids,TV Show ALL kids unknown
TV Show,welcome to the ballroom,shinba tsuchiya | ayane sakura | nobuhiko okamoto | kentaro tomita | sumire morohoshi,TV-NR,tv shows,TV Show TV-NR tv shows shinba tsuchiya | ayane sakura | nobuhiko okamoto | kentaro tomita | sumire morohoshi
TV Show,wayne (4k uhd),mark mckenna  ciara bravo  jon champagne,TV-MA,drama,TV Show TV-MA drama mark mckenna  ciara bravo  jon champagne
TV Show,watch the game like never before with x-ray,unknown,TV-NR,tv shows,TV Show TV-NR tv shows unknown
TV Show,wallace & gromit's cracking contraptions,peter sallis,TV-NR,"animation, comedy, kids","TV Show TV-NR animation, comedy, kids peter sallis"
TV Show,wallace & gromit: the complete collection,peter sallis,TV-NR,"animation, comedy, kids","TV Show TV-NR animation, comedy, kids peter sallis"
TV Show,wake in fright,sean keenan  alex dimitriades  caren pistorius,16+,"action, drama, suspense","TV Show 16+ action, drama, suspense sean keenan  alex dimitriades  caren pistorius"
TV Show,wakaalat from home,sumeet vyas  nidhi singh  kubbra sait,16+,comedy,TV Show 16+ comedy sumeet vyas  nidhi singh  kubbra sait
TV Show,wahlburgers,mark wahlberg  donnie wahlberg  paul wahlberg,TV-PG,"documentary, drama, unscripted","TV Show TV-PG documentary, drama, unscripted mark wahlberg  donnie wahlberg  paul wahlberg"
TV Show,waco: madman or messiah,unknown,TV-14,"documentary, special interest","TV Show TV-14 documentary, special interest unknown"
TV Show,voyage of the continents,unknown,13+,"documentary, special interest","TV Show 13+ documentary, special interest unknown"
TV Show,vocabulary and numbers with harry the bunny and friends,unknown,ALL,tv shows,TV Show ALL tv shows unknown
TV Show,vinland saga,shizuka ishigami  yuto uemura  kenichiro matsuda,TV-NR,anime,TV Show TV-NR anime shizuka ishigami  yuto uemura  kenichiro matsuda
TV Show,vikings,alex høgh  alexander ludwig  jasper pääkkönen,TV-14,"action, drama","TV Show TV-14 action, drama alex høgh  alexander ludwig  jasper pääkkönen"
TV Show,victorian farm: christmas special,stephen noonan,ALL,tv shows,TV Show ALL tv shows stephen noonan
TV Show,victorian farm,ruth goodman  alex langlands  peter ginn,TV-14,documentary,TV Show TV-14 documentary ruth goodman  alex langlands  peter ginn
TV Show,vets in action,kym marsh,13+,"documentary, special interest","TV Show 13+ documentary, special interest kym marsh"
TV Show,very superstitious with george lopez,george lopez  harris jacqueline matherne,TV-14,"documentary, drama, unscripted","TV Show TV-14 documentary, drama, unscripted george lopez  harris jacqueline matherne"
TV Show,vella raja (tamil),unknown,16+,"drama, international, suspense","TV Show 16+ drama, international, suspense unknown"
TV Show,vella raja (hindi),unknown,16+,"action, international","TV Show 16+ action, international unknown"
TV Show,vatican miracle examiner,unknown,TV-14,"anime, drama, international","TV Show TV-14 anime, drama, international unknown"
TV Show,vanity fair,olivia cooke  claudia jessie  tom bateman,13+,drama,TV Show 13+ drama olivia cooke  claudia jessie  tom bateman
TV Show,utopia,john cusack  rainn wilson  sasha lane,16+,"drama, suspense","TV Show 16+ drama, suspense john cusack  rainn wilson  sasha lane"
TV Show,uq holder!,unknown,TV-14,"action, adventure, anime","TV Show TV-14 action, adventure, anime unknown"
TV Show,upload,robbie amell  andy allo  allegra edwards,16+,comedy,TV Show 16+ comedy robbie amell  andy allo  allegra edwards
TV Show,unforgotten,nicola walker  sanjeev bhaskar  james fleet,TV-MA,suspense,TV Show TV-MA suspense nicola walker  sanjeev bhaskar  james fleet
TV Show,undone,rosa salazar  angelique cabral  constance marie,16+,"animation, drama","TV Show 16+ animation, drama rosa salazar  angelique cabral  constance marie"
TV Show,under the power,allen ren  seven tan  han dong,TV-14,"drama, romance","TV Show TV-14 drama, romance allen ren  seven tan  han dong"
TV Show,undeniable,claire goose  peter firth  felix scott,16+,"drama, suspense","TV Show 16+ drama, suspense claire goose  peter firth  felix scott"
TV Show,uncle,nick helm  elliot speller-gillott  daisy haggard,TV-14,comedy,TV Show TV-14 comedy nick helm  elliot speller-gillott  daisy haggard
TV Show,uncharted waters with peter miller,peter miller,TV-PG,"special interest, sports","TV Show TV-PG special interest, sports peter miller"
TV Show,uncabaret,beth lapides  mitch kaplan,TV-MA,"arts, entertainment, and culture, comedy","TV Show TV-MA arts, entertainment, and culture, comedy beth lapides  mitch kaplan"
TV Show,ufo hunters,william j. birnes,TV-PG,"documentary, special interest","TV Show TV-PG documentary, special interest william j. birnes"
TV Show,ufo files,burton richardson  stanton friedman,TV-PG,"horror, suspense","TV Show TV-PG horror, suspense burton richardson  stanton friedman"
TV Show,uchimura summers,teruyoshi uchimura  masakazu mimura  kazuki otake,TV-NR,"arts, entertainment, and culture","TV Show TV-NR arts, entertainment, and culture teruyoshi uchimura  masakazu mimura  kazuki otake"
TV Show,tutu town,unknown,TV-Y,"animation, international, kids","TV Show TV-Y animation, international, kids unknown"
TV Show,turquoise fever,otteson family,TV-G,"action, drama","TV Show TV-G action, drama otteson family"
TV Show,tumble leaf,christopher downs  brooke wolloff  zac mcdowell,ALL,kids,TV Show ALL kids christopher downs  brooke wolloff  zac mcdowell
TV Show,tudor monastery farm,peter ginn  ruth goodman  tom pinfold,7+,documentary,TV Show 7+ documentary peter ginn  ruth goodman  tom pinfold
TV Show,truth seekers,nick frost  malcolm mcdowell  samson kayo,16+,comedy,TV Show 16+ comedy nick frost  malcolm mcdowell  samson kayo
TV Show,troy the train,unknown,ALL,"animation, kids","TV Show ALL animation, kids unknown"
TV Show,travels by narrowboat,kevin shelley,18+,"documentary, special interest","TV Show 18+ documentary, special interest kevin shelley"
TV Show,travel with kids,nathan simmons  seamus simmons,ALL,"kids, special interest","TV Show ALL kids, special interest nathan simmons  seamus simmons"
TV Show,trapped [english subtitled],unknown,TV-14,tv shows,TV Show TV-14 tv shows unknown
TV Show,transparent,trace lisette  missi pyle  tig notaro,18+,"comedy, drama, lgbtq","TV Show 18+ comedy, drama, lgbtq trace lisette  missi pyle  tig notaro"
TV Show,trail of tears,various,13+,"documentary, special interest","TV Show 13+ documentary, special interest various"
TV Show,tougher in alaska,geo beach,TV-PG,tv shows,TV Show TV-PG tv shows geo beach
TV Show,totally spies!,jennifer hale  andrea baker  katie griffin,TV-Y7,kids,TV Show TV-Y7 kids jennifer hale  andrea baker  katie griffin
TV Show,total wipeout,richard hammond  amanda byram,ALL,"comedy, documentary, unscripted","TV Show ALL comedy, documentary, unscripted richard hammond  amanda byram"
TV Show,toradora!,rie kugimiya  junji majima,TV-14,"animation, anime, drama","TV Show TV-14 animation, anime, drama rie kugimiya  junji majima"
TV Show,top gear's top 41,richard hammond,TV-PG,documentary,TV Show TV-PG documentary richard hammond
TV Show,top gear: the perfect road trip italy,richard hammond  jeremy clarkson,TV-PG,documentary,TV Show TV-PG documentary richard hammond  jeremy clarkson
TV Show,top gear: the perfect road trip,jeremy clarkson  richard hammond,TV-PG,unscripted,TV Show TV-PG unscripted jeremy clarkson  richard hammond
TV Show,top gear: from a-z,richard hammond  james may  jeremy clarkson,TV-14,tv shows,TV Show TV-14 tv shows richard hammond  james may  jeremy clarkson
TV Show,top gear: ambitious but rubbish,richard hammond,TV-PG,documentary,TV Show TV-PG documentary richard hammond
TV Show,top gear america (2017),william fichtner  tom ford  antron brown,TV-14,special interest,TV Show TV-14 special interest william fichtner  tom ford  antron brown
TV Show,too old to die young,babs olusanmokun  augusto aguilera  john hawkes,18+,tv shows,TV Show 18+ tv shows babs olusanmokun  augusto aguilera  john hawkes
TV Show,tommy little: self-diagnosed genius,tommy little,16+,"arts, entertainment, and culture","TV Show 16+ arts, entertainment, and culture tommy little"
TV Show,tom's paint shop,unknown,ALL,"animation, kids","TV Show ALL animation, kids unknown"
TV Show,tom walker: very very,tom walker,16+,"comedy, talk show and variety","TV Show 16+ comedy, talk show and variety tom walker"
TV Show,tom the tow truck of car city,kevin charles,ALL,"animation, kids","TV Show ALL animation, kids kevin charles"
TV Show,tom gleeson: joy,tom gleeson,16+,tv shows,TV Show 16+ tv shows tom gleeson
TV Show,tom clancy's jack ryan,john krasinski  wendell pierce  noomi rapace,16+,"action, drama, suspense","TV Show 16+ action, drama, suspense john krasinski  wendell pierce  noomi rapace"
TV Show,tokyo vampire hotel,ami tomite  shinnosuke mitsushima  megumi kagurazaka,18+,"fantasy, horror, international","TV Show 18+ fantasy, horror, international ami tomite  shinnosuke mitsushima  megumi kagurazaka"
TV Show,tokyo girl,asami mizukawa,13+,"drama, international","TV Show 13+ drama, international asami mizukawa"
TV Show,tokyo alice,aya asahina  maryjun takahashi  reina triendl,13+,"drama, romance","TV Show 13+ drama, romance aya asahina  maryjun takahashi  reina triendl"
TV Show,toddworld,unknown,ALL,"animation, kids","TV Show ALL animation, kids unknown"
TV Show,toca life stories,cassandra morris  colleen o'shaugnessey  corina boettger,unknown,"action, animation, kids","TV Show unknown action, animation, kids cassandra morris  colleen o'shaugnessey  corina boettger"
TV Show,to tell the truth with bud collyer,bud collyer,TV-G,tv shows,TV Show TV-G tv shows bud collyer
TV Show,tiny trucks,unknown,ALL,"animation, kids","TV Show ALL animation, kids unknown"
TV Show,tin star,tim roth  christina hendricks  genevieve o'reilly,18+,"drama, suspense","TV Show 18+ drama, suspense tim roth  christina hendricks  genevieve o'reilly"
TV Show,timmy time,unknown,ALL,"animation, kids","TV Show ALL animation, kids unknown"
TV Show,time team america,unknown,TV-PG,special interest,TV Show TV-PG special interest unknown
TV Show,time enna boss (telugu),bharath niwas  priya bhavanishankar  robo shankar,13+,"comedy, international","TV Show 13+ comedy, international bharath niwas  priya bhavanishankar  robo shankar"
TV Show,time enna boss,bharath niwas  priya bhavanishankar  robo shankar,13+,"comedy, international","TV Show 13+ comedy, international bharath niwas  priya bhavanishankar  robo shankar"
TV Show,thunderbirds are go,rasmus hardiker  thomas brodie-sangster  david menkin,ALL,kids,TV Show ALL kids rasmus hardiker  thomas brodie-sangster  david menkin
TV Show,threesome,amy huberman  emun elliott  stephen wright,TV-MA,comedy,TV Show TV-MA comedy amy huberman  emun elliott  stephen wright
TV Show,thomas & friends s22 (us),unknown,TV-Y7,"animation, kids","TV Show TV-Y7 animation, kids unknown"
TV Show,thomas & friends classic,michael brandon,TV-Y,kids,TV Show TV-Y kids michael brandon
TV Show,this is me,unknown,13+,"documentary, drama, lgbtq","TV Show 13+ documentary, drama, lgbtq unknown"
TV Show,this is football,pep guardiola  oliver khan  brandi chastain,13+,"documentary, sports, unscripted","TV Show 13+ documentary, sports, unscripted pep guardiola  oliver khan  brandi chastain"
TV Show,this giant beast that is the global economy,kal penn  cristela alonzo  tone bell,16+,"documentary, special interest","TV Show 16+ documentary, special interest kal penn  cristela alonzo  tone bell"
TV Show,them,deborah ayorinde  ashley thomas  alison pill,TV-14,"drama, horror, suspense","TV Show TV-14 drama, horror, suspense deborah ayorinde  ashley thomas  alison pill"
TV Show,thella raju (telugu),unknown,16+,"drama, international","TV Show 16+ drama, international unknown"
TV Show,the wubbulous world of dr. seuss,martin p. robinson  anthony asbury  john kennedy,TV-Y,kids,TV Show TV-Y kids martin p. robinson  anthony asbury  john kennedy
TV Show,the world wars,unknown,TV-14,special interest,TV Show TV-14 special interest unknown
TV Show,the wolf,li qin  wang dalu  xiao zhan,13+,"drama, romance","TV Show 13+ drama, romance li qin  wang dalu  xiao zhan"
TV Show,the witching season,michael ballif  james morris  hailey nebeker,13+,horror,TV Show 13+ horror michael ballif  james morris  hailey nebeker
TV Show,the wilds,rachel griffiths  sophia ali  reign edwards,16+,"drama, suspense, young adult audience","TV Show 16+ drama, suspense, young adult audience rachel griffiths  sophia ali  reign edwards"
TV Show,the whole package,robyn daye edwards  wade hopwo  dan lypchuk,18+,"drama, lgbtq, unscripted","TV Show 18+ drama, lgbtq, unscripted robyn daye edwards  wade hopwo  dan lypchuk"
TV Show,the vineyard,leonor watling  rafael novoa  nathaniel parker,16+,drama,TV Show 16+ drama leonor watling  rafael novoa  nathaniel parker
TV Show,the untamed,sean xiao  wang yi bo  zoey meng,13+,drama,TV Show 13+ drama sean xiao  wang yi bo  zoey meng
TV Show,the underground railroad,thuso mbedu  joel edgerton  chase w. dillon,TV-MA,drama,TV Show TV-MA drama thuso mbedu  joel edgerton  chase w. dillon
TV Show,"the unauthorized beverly hills, 90210 story",dan castellaneta  samantha munro  jesy mckinney,TV-14,tv shows,TV Show TV-14 tv shows dan castellaneta  samantha munro  jesy mckinney
TV Show,the ultimate civil war series,unknown,13+,documentary,TV Show 13+ documentary unknown
TV Show,the twin flower legend,yu xiao tong  guan zhi bin  mao xiao hui,18+,"drama, romance","TV Show 18+ drama, romance yu xiao tong  guan zhi bin  mao xiao hui"
TV Show,the tunnel,unknown,NR,"drama, suspense","TV Show NR drama, suspense unknown"
TV Show,the triangle,eric stoltz  catherine bell  lou diamond phillips,16+,tv shows,TV Show 16+ tv shows eric stoltz  catherine bell  lou diamond phillips
TV Show,the trial: a murder in the family,michael gould  emma lowndes  kevin harvey,16+,"drama, suspense","TV Show 16+ drama, suspense michael gould  emma lowndes  kevin harvey"
TV Show,the toothbrush family,unknown,ALL,tv shows,TV Show ALL tv shows unknown
TV Show,the time of our lives,justine clarke  shane jacobson  william mcinnes,16+,drama,TV Show 16+ drama justine clarke  shane jacobson  william mcinnes
TV Show,the tick,peter serafinowicz  griffin newman  valorie curry,18+,"action, comedy","TV Show 18+ action, comedy peter serafinowicz  griffin newman  valorie curry"
TV Show,the three drinkers do scotch whisky,colin hampden-white  aidy smith  helena nicklin,16+,"special interest, unscripted","TV Show 16+ special interest, unscripted colin hampden-white  aidy smith  helena nicklin"
TV Show,the test: a new era for australia's team,unknown,16+,documentary,TV Show 16+ documentary unknown
TV Show,the tesla files,marc seifer  jonathan adam,TV-PG,"documentary, special interest","TV Show TV-PG documentary, special interest marc seifer  jonathan adam"
TV Show,the terror routes,unknown,13+,"documentary, international, special interest","TV Show 13+ documentary, international, special interest unknown"
TV Show,the surgeon,justine clarke  sam worthington  nicholas bell,13+,"drama, suspense","TV Show 13+ drama, suspense justine clarke  sam worthington  nicholas bell"
TV Show,the story of egypt,unknown,13+,"documentary, special interest","TV Show 13+ documentary, special interest unknown"
TV Show,the stinky & dirty show,issac ryan brown  jet jurgensmeyer,ALL,kids,TV Show ALL kids issac ryan brown  jet jurgensmeyer
TV Show,the snowy day,donielle hansley  laurence fishburne  regina king,ALL,kids,TV Show ALL kids donielle hansley  laurence fishburne  regina king
TV Show,the snow queen,pax baldwin  sydney white  juliet stevenson,TV-PG,"action, fantasy","TV Show TV-PG action, fantasy pax baldwin  sydney white  juliet stevenson"
TV Show,the smoke,jamie bamber  taron egerton  gerard kearns,16+,tv shows,TV Show 16+ tv shows jamie bamber  taron egerton  gerard kearns
TV Show,the sleepless princess,yecheng zheng  yixuan hu  cancan huang,18+,"comedy, drama, romance","TV Show 18+ comedy, drama, romance yecheng zheng  yixuan hu  cancan huang"
TV Show,the silk road,alfred de montesquiou,13+,"documentary, special interest","TV Show 13+ documentary, special interest alfred de montesquiou"
TV Show,the secrets of quantum physics,jim al-khalili,13+,"documentary, special interest","TV Show 13+ documentary, special interest jim al-khalili"
TV Show,the secret life of us,deborah mailman  david tredinnick  samuel johnson,13+,"drama, romance","TV Show 13+ drama, romance deborah mailman  david tredinnick  samuel johnson"
TV Show,the royle family,brian viner,TV-PG,comedy,TV Show TV-PG comedy brian viner
TV Show,the royals,unknown,TV-14,tv shows,TV Show TV-14 tv shows unknown
TV Show,the romanoffs,jack huston  paul reiser  diane lane,16+,drama,TV Show 16+ drama jack huston  paul reiser  diane lane
TV Show,the ride that got away,courtney hansen  troy ladd,13+,special interest,TV Show 13+ special interest courtney hansen  troy ladd
TV Show,the remix,akhil talreja  amit trivedi  karan tacker,13+,"international, music videos and concerts, unscripted","TV Show 13+ international, music videos and concerts, unscripted akhil talreja  amit trivedi  karan tacker"
TV Show,the record,unknown,unknown,"documentary, sports","TV Show unknown documentary, sports unknown"
TV Show,the pyramid - finding the truth,dr. sam osmanagich  dr. robert schoch  dr. nabil swelim,ALL,"documentary, faith and spirituality, special interest","TV Show ALL documentary, faith and spirituality, special interest dr. sam osmanagich  dr. robert schoch  dr. nabil swelim"
TV Show,the private lives of the tudors,unknown,13+,documentary,TV Show 13+ documentary unknown
TV Show,the prince family,the prince family,TV-14,"kids, special interest","TV Show TV-14 kids, special interest the prince family"
TV Show,the playground (minecraft roleplay),tycer  dan,7+,"animation, comedy, science fiction","TV Show 7+ animation, comedy, science fiction tycer  dan"
TV Show,the passing bells,patrick gibson  jack lowden  sabrina bartlett,13+,tv shows,TV Show 13+ tv shows patrick gibson  jack lowden  sabrina bartlett
TV Show,the paradise,joanna vanderham  emun elliott  elaine cassidy,TV-PG,"drama, romance","TV Show TV-PG drama, romance joanna vanderham  emun elliott  elaine cassidy"
TV Show,the paleo way,pete evans,ALL,"documentary, special interest","TV Show ALL documentary, special interest pete evans"
TV Show,the office,lucy davis  ricky gervais  martin freeman,TV-14,comedy,TV Show TV-14 comedy lucy davis  ricky gervais  martin freeman
TV Show,the nurse,unknown,7+,"documentary, special interest","TV Show 7+ documentary, special interest unknown"
TV Show,the notekins - musical friends,unknown,ALL,"animation, kids, special interest","TV Show ALL animation, kids, special interest unknown"
TV Show,the night manager,hugh laurie  tom hiddleston  nader boussandel,18+,"action, drama, suspense","TV Show 18+ action, drama, suspense hugh laurie  tom hiddleston  nader boussandel"
TV Show,the next steps,anthony fanelli  lyndsey doolen,13+,comedy,TV Show 13+ comedy anthony fanelli  lyndsey doolen
TV Show,the next step,myles erlick  shelby bain  victoria baldesarra,TV-G,"drama, unscripted, young adult audience","TV Show TV-G drama, unscripted, young adult audience myles erlick  shelby bain  victoria baldesarra"
